Mukhachitram	2022	Gangadhar	Dr. Rajkumar, a plastic surgeon marries Mahati, a shy & traditional village girl , leaving his his childhood love Maya Fernandez heartbroken.  A tragedy strikes the couple, months after  their marraige, which leads to a plastic surgery later, Maya 'becomes' Mahati.	['Vikas Vashishta', 'Priya Vadlamani', 'Vishwak Sen', 'Ayesha Khan', 'Chaitanya Rao', 'P. Ravi Shankar', 'Sunil Varma', 'I Dream Anjali', 'Harsh Roshan']	[]	['India']	[]	['Telugu']	['thriller', 'crime', 'drama']	[]
Rakhi	2006	Pasupuleti Krishna Vamsi	An ambitious and young man named Rama Krishna avenges his sister's death after her in-laws burn her alive due to their greed for dowry. Thereafter, he starts killing every man that harasses a woman.	"['N. T. Rama Rao Jr.', ""Ileana D'Cruz"", 'Charmy Kaur', 'Suhasini Maniratnam', 'Chandramohan', 'Kota Srinivasa Rao', 'Saranya Ponvannan', 'Brahmanandam', 'Ravi Varma', 'Sunil Varma', 'Sayaji Shinde', 'Sarath Babu', 'Dharmavarupu Subramanyam', 'Tanikella Bharani', 'Brahmaji', 'Amit Kumar Tiwari', 'M. S. Narayana', 'Uttej', 'Prakash Raj']"	['Sri Durga Arts']	['India']	[]	['Telugu']	['action', 'drama']	[]
Kumari 21F	2015	Palnati Surya Pratap	A young man's love for his girlfriend, who is a model and moves very free to every one is tested by the rumors surrounding her.	['Raj Tarun', 'Hebah Patel', 'Noel Sean', 'Hema', 'Nellore Sudharshan', 'Naveen Neni', 'Bhanu Sri', 'Vajja Venkata Giridhar', 'Venu Tillu', 'Satya Krishnan']	['P. A. Motion Pictures']	['India']	[]	['Telugu']	['drama', 'romance']	[]
Don Seenu	2010	Gopichand Malineni	This story is all about a ambitious boy named Seenu (Ravi Teja) who dreams of becoming a don. He always likes to be called as ‘Don’ Seenu since childhood due to the strong influence of the Amitabh Bachchan starrer ‘Don’. He grows up with just one passion - that of becoming the World's No: 1 Don. Thanks to his enterprising nature, he gains access to the cream of the city's dons, and uses his cleverness to play off the top two - Machiraju (Sayaji Shinde) and Narsing (Sri Hari), fierce rivals - against each other.	['Ravi Teja', 'Shriya Saran', 'Anjana Sukhani', 'Mahesh Manjrekar', 'Sayaji Shinde', 'Srihari', 'Brahmanandam', 'John Kokken', 'Ali Basha', 'Sudha', 'Raghu Babu', 'Venu Madhav', 'Brahmaji', 'Raghu Karumanchi']	[]	['India']	[]	['Telugu']	['comedy', 'action', 'drama']	[]
Mirapakay	2011	Harish Shankar	Rishi (Ravi Teja) is an inspector in the Intelligence Bureau. His colleagues fondly call him 'Mirapakaay'. The chief of the IB, Narayana Murthy (Nagababu) gets information that Kittu Bhai (Prakash Raj), a mafia don, is trying to spread his tentacles in India and is targeting Delhi first. During the course of the investigation, ACP (Sanjay Swaroop) is killed by Shankar (Kota Srinivasa Rao), a local goon with the help of his son (Supreet). Murthy sends Rishi to Hyderabad and gets him admitted to a college as a Hindi lecturer as part of an undercover operation. Rishi meets Vinamra (Richa Gangopadhyay) at a temple & falls in love at first sight. Incidentally, she studies in the same college and in the same class to which Rishi teaches Hindi. Their love blossoms. At this juncture, Vaishali (Deeksha Seth), daughter of Kittu Bhai, joins the same college. Grabbing the opportunity, the IB chief asks Rishi to extract information about Kittu from Vaishali.	['Ravi Teja', 'Richa Gangopadhyay', 'Deeksha Seth', 'Prakash Raj', 'Kota Srinivasa Rao', 'Sunil Varma', 'Ajay', 'Nagendra Babu', 'Chandramohan', 'Dharmavarupu Subramanyam', 'Brahmaji', 'Raja Ravindra', 'Supreet', 'Rao Ramesh', 'Praveen', 'Ali Basha', 'Fish Venkat', 'Prudhviraj']	[]	['India']	[]	['Telugu']	['comedy', 'action']	[]
Amma Nanna O Tamila Ammayi	2003	Puri Jagannadh	Chandu is very passionate about kickboxing and his life revolves around his mother and his girlfriend. His life is shattered when his dying mother asks him to meet his estranged father Raghuveer.	['Ravi Teja', 'Asin Thottumkal', 'Jayasudha', 'Prakash Raj', 'Subbaraju', 'Ali Basha', 'Gautam Raju', 'M. S. Narayana', 'Jogi Naidu', 'Dharmavarupu Subramanyam', 'Aishwarya Bhaskar', 'Junior Relangi', 'Kadambari Kiran', 'Alphonsa', 'Bandla Ganesh']	['Sri Balaji Cine Creations', 'Vaishno Academy']	['India']	[]	['Telugu']	['drama', 'romance']	[]
Ghani	2022	Kiran Korrapati	The life of a boxer whose passion is sports who has been training since a young age to reach his dreams suddenly things take a tough turn which totally changes his life.	['Varun Tej', 'Saiee Manjrekar', 'Jagapati Babu', 'Upendra', 'Suniel Shetty', 'Naveen Chandra', 'Nadhiya', 'Tanikella Bharani', 'Naresh', 'Lahari Shari', 'Tamannaah Bhatia']	['Renaissance Pictures']	['India']	[]	['Telugu']	['action', 'drama']	[]
Manamantha	2016	Chandra Sekhar Yeleti	Sairam, an assistant manager in a supermarket treads on an unethical path for a promotion, leading to dire consequences. Gayatri a thrifty housewife manages her middle class household. Mahitha's friend, a street child goes missing and she goes out of her way to find him. Abhiram, the bright student falls in love with Aira and pursues her. Four stories seemingly unrelated are all bound by one string called family.	['Mohanlal', 'Gautami Tadimalla', 'Viswant Duddumpudi', 'Raina Rao', 'Anisha Ambrose', 'Harshavardhan', 'Urvashi', 'Chandramohan', 'Dhanraj Sukhram', 'Ayyappa P. Sharma', 'Gollapudi Maruti Rao', 'Nassar', 'Vennela Kishore', 'Venkateswara Rao Paruchuri', 'Brahmaji', 'Chaitanya Krishna', 'L. B. Sriram', 'Shankar Melkote', 'Praveen']	['Maxlab Cinemas and Entertainments', 'Vaaraahi Chalana Chitram']	['India']	['Telugu']	['Telugu', 'Malayalam', 'Tamil']	['drama', 'family', 'thriller']	[]
Raju Gari Gadhi 2	2017	Ohmkar	Three friends — Ashwin, Kishore and Praveen get into business by purchasing a resort. Pretty soon, they find that they've got more than what they've bargained for. Apparently, the resort is haunted by a ghost. Unwilling to sell the resort, they seek the help of a mentalist, Rudra, to exorcise the ghost.	['Nagarjuna Akkineni', 'Samantha Ruth Prabhu', 'Seerat Kapoor', 'Vennela Kishore', 'Abhinaya', 'Praveen', 'Rao Ramesh', 'Shakalaka Shankar', 'Ashwin Babu', 'Nandu Vijay Krishna', 'Avinash', 'Devan', 'Annapoorna', 'Tejaswi Madivada', 'Satya Krishnan', 'Geetha Singh', 'Dasari Narayana Rao', 'Mukhtar Khan', 'Bhupal Raju']	['OAK Entertainments Pvt. Ltd', 'PVP Cinema', 'Matinee Entertainment']	['India']	[]	['Telugu']	['thriller', 'horror', 'crime']	[]
Majnu	2016	Virinchi Varma	The film is about the romantic life of an assistant director Aditya (Nani) and his relationships with 2 women (Anu Emmanuel and Priya Shri) while he attempts to write a romantic comedy story.	['Nani', 'Anu Emmanuel', 'Riya Suman', 'Raj Tarun', 'Vennela Kishore', 'Posani Krishna Murali', 'Dhritiman Chatterjee', 'Saptagiri', 'Satya Krishnan', 'Raj Madiraju', 'S. S. Rajamouli', 'Satya']	['Anandi Art Creations', 'KevaMovies']	['India']	[]	['Telugu']	['romance', 'comedy']	[]
Idiot	2002	Puri Jagannadh	Chanti, a young man, is rescued by Suchitra when he is beaten by thugs. He falls in love with her and tries to woo her, but she does not reciprocate his feelings.	['Ravi Teja', 'Rakshita', 'Prakash Raj', 'Ali Basha', 'Kota Srinivasa Rao', 'Srinivasa Reddy', 'Sairam Shankar', 'Giri Babu', 'Jeeva', 'Prudhviraj', 'M. S. Narayana', 'Narsing Yadav', 'Kaikala Satyanarayana', 'Junior Relangi']	['Vaishno Academy']	['India']	[]	['Telugu']	['romance', 'action', 'comedy']	[]
Tagore	2003	V. V. Vinayak	Tagore (Chiranjeevi) creates his own vigilante military network called the Anti-Corruption Force (ACF) that eliminates the most corrupt individuals, from all walks of life, in a systematic manner. As pressure builds on Police and Government to track down the Man who masterminds these killings, Balbir Singh (Puneet Issar), is specially summoned to head the task. He is aided by Suryam (Prakash Raj) who, though being just a constable in the mammoth Police force, is compelled by his instincts to see through the underlying design. Together they unravel the mystery and unveil the phenomenon called Tagore, but not before Badrinaryana (Sayaji Shinde), the human face of evil, finds out that his revelry in the belief of Tagore’s death was a mistake he can never make amends for.	['Chiranjeevi', 'Jyothika', 'Shriya Saran', 'Prakash Raj', 'Sayaji Shinde', 'Sunil Varma', 'M. S. Narayana', 'K. Viswanath', 'Ahuti Prasad', 'V. V. Vinayak', 'Rama Prabha', 'Teja Sajja', 'Sameer Hasan', 'Venu Madhav', 'Dharmavarupu Subramanyam', 'Uttej', 'Raja Ravindra']	[]	['India']	[]	['Telugu']	['action', 'drama']	[]
Mahanubhavudu	2017	Maruthi Dasari	Anand is a cleanliness freak, someone suffering from OCD . What happens when a man like that falls in love? Will the person he loves learn to live with his quirks or will he have to change?	['Sharwanand', 'Mehreen Pirzada', 'Vennela Kishore', 'Nassar', 'Raghu Babu', 'Kalyani Natarajan', 'Duvvasi Mohan', 'Anand Ramaraju']	['UV Creations']	['India']	[]	['Telugu']	['comedy', 'romance', 'family']	[]
Ek Niranjan	2009	Puri Jagannadh	A bounty hunter searches for the family he was separated from as a child, and falls in love with the sister of a gang member.	['Prabhas', 'Kangana Ranaut', 'Sonu Sood', 'Mukul Dev', 'Venu Madhav', 'Brahmanandam', 'Ali Basha', 'Brahmaji', 'Tanikella Bharani', 'Posani Krishna Murali', 'Makrand Deshpande', 'Sunil Varma', 'Chalapathi Rao', 'Gautam Raju', 'Prudhviraj', 'Abhinaya Sri', 'Sangeeta', 'Sravan Raghavendra', 'Akash Puri', 'Satya Prakash']	['Aditya Ram Movies']	['India']	[]	['Telugu']	['drama', 'romance', 'action']	[]
Guru	2017	Sudha Kongara Prasad	A grumpy boxing coach takes on a young, rebellious woman under his wings and starts training her for the world championship. But their biggest battle has to be fought outside the ring.	['Venkatesh', 'Ritika Singh', 'Mumtaz Sorcar', 'Nassar', 'Tanikella Bharani', 'Zakir Hussain', 'Raghu Babu', 'Sanchana Natarajan']	['Y NOT Studios']	['India']	[]	['Telugu']	['drama', 'action']	[]
Pournami	2006	Prabhu Deva	A dancer trains for an event where she has to perform a special dance in Lord Shiva's temple. But when she suddenly disappears, her younger sister Chandrakala decides to learn the dance.	['Trisha Krishnan', 'Prabhas', 'Charmy Kaur', 'Rahul Dev', 'Ajay', 'Sindhu Tolani', 'Mukesh Rishi', 'Geetha', 'Madhu Sharma', 'Kota Srinivasa Rao', 'Chandramohan', 'Manju Bhargavi', 'Sunil Varma', 'Tanikella Bharani', 'Archana', 'Harshavardhan', 'Subbaraju', 'Brahmaji', 'Narsing Yadav', 'Mallikarjuna Rao', 'Prabhas Sreenu', 'Venkateswara Rao Paruchuri', 'Narra Venkateswara Rao', 'G. V. Sudhakar Naidu']	['Sumanth Art Productions']	['India']	[]	['Telugu']	['action', 'drama']	[]
Ragada	2010	Veeru Potla	A local village rowdy arrives in the city to earn money by any means and participates in a brawl between two rivals that brings him to their attention.	['Nagarjuna Akkineni', 'Anushka Shetty', 'Priyamani', 'Dev Gill', 'Pradeep Ram Singh Rawat', 'Kota Srinivasa Rao', 'Brahmanandam', 'Tanikella Bharani', 'Raghu Babu', 'Master Bharath', 'Charmy Kaur', 'Bharath Reddy']	[]	['India']	[]	['Telugu']	['action']	[]
Kick 2	2015	Surender Reddy	A doctor living abroad returns to India to sell his property, where he falls in love with a woman who tries to get him to help the people in her village.	"['Ravi Teja', 'Rakul Preet Singh', 'Brahmanandam', 'Tanikella Bharani', 'Ravi Kishan', 'Rajpal Yadav', 'Ashish Vidhyarthi', 'Posani Krishna Murali', ""Ileana D'Cruz"", 'Kovai Sarala', 'Nora Fatehi', 'Shaam', 'Srinivasa Reddy', 'Madhusudhan Rao', 'Indrasena', 'Darbha Appaji Ambarisha']"	['N. T. R. Arts']	['India']	[]	['Telugu']	['comedy', 'action', 'romance']	[]
Daruvu	2012	Siva	In Yamalokam retirement age comes from Senior Yama and he gives charge to his Son. However experienced Chitragupta is retained much to his disappointment. He decides to teach a lesson to new Yama and plans to get a person from Bhulokam who can create chaos in Yamalokam. That person turns out to be Bullet Raja a mass character. He falls in love with Taapsee. Though he is yet to complete his lifespan,Chitragupta plays a game and Bullet Raja gets killed only to come to hell. Here he discovers the plot and demands to get back to earth. Since his body has perished, Yama and Chitragupta send him inside the home ministers body. What happens from there and how things change forms rest of the story.	['Ravi Teja', 'Taapsee Pannu', 'Sayaji Shinde', 'Prabhu', 'Kaikala Satyanarayana', 'M. S. Narayana', 'Jayasudha', 'John Kokken', 'Vennela Kishore', 'Dharmavarupu Subramanyam', 'Fish Venkat', 'Sushant Singh', 'Brahmanandam', 'Srinivasa Reddy', 'Raghu Babu', 'Brahmaji']	['Sri Venkateswara Entertainments']	['India']	[]	['Telugu']	['action', 'drama', 'comedy', 'fantasy']	[]
Simha	2010	Boyapati Srinu	The film starts with the story of the younger Bala Krishna (Srimannarayana) working as a college professor. As usual the best looking girl of the college (Janaki played by Sneha Ullal) falls in love with Srimannarayana (the monkish protector of justice); reasons for that are comprehendible only by someone who had seen enough Telugu films (Bala Krishna films in particular). As the first half progresses the screenplay tells us that Janaki’s and Srimmanarayna’s pasts are related and the flashback starts occupying the screen. The daddy Bala Krishna with Nayanatara next to him and Kota Srinivas Rao playing the bad guy in a war between good and evil about the welfare of the region is the film’s flashback	['Nandamuri Balakrishna', 'Nayanthara', 'Sneha Ullal', 'Brahmanandam', 'Kota Srinivasa Rao', 'Ali Basha', 'Venu Madhav', 'Adithya Menon', 'Fish Venkat', 'Ravi Prakash', 'Dharmavarupu Subramanyam', 'Krishna Bhagavan', 'Anand Ramaraju']	[]	['India']	[]	['Telugu']	['action', 'drama']	[]
Aithe	2003	Chandra Sekhar Yeleti	With a price on his head, powerful Mumbai gangster Irfan Khan (Pavan Malhotra) devises a complicated plan to flee the country and hires four unsuspecting accomplices to help him hijack a plane to Kathmandu. His goal is to set up shop abroad and run his Indian crime empire remotely, but as the four assistants realize what he's up to, it becomes unclear whether Khan's scheme will get off the ground.	['Mohit Chadda', 'Shashank', 'Shankar', 'Abhishek', 'Sindhu Tolani', 'Pavan Malhotra', 'veerendra chowhan', 'Likhitha', 'Shivaji Raja', 'Harshavardhan', 'C. V. L. Narasimha Rao', 'Narsing Yadav', 'Sanjay Raichura', 'Lalith Sharma']	['Just Yellow Media']	['India']	[]	['Telugu']	['thriller', 'drama', 'adventure']	[]
Chal Mohan Ranga	2018	Chaitanya Krishna	A young man with dreams of making it big in the USA falls in love with an NRI woman residing there. She breaks up with him for reasons unknown to him but serendipity plays cupid.	['Nithiin', 'Megha Akash', 'Madhunandan', 'Lissy', 'Rao Ramesh', 'Naresh', 'Pragathi Mahavadi', 'Sanjay Swaroop', 'Neeraja Kona', 'Kireeti Damaraju', 'Ashu Reddy', 'Rohini Hattangadi', 'Satya', 'Srinivasa Reddy', 'Narra Srinu']	['Pawan Kalyan Creative Works', 'Sreshth Movies']	['India']	[]	['Telugu']	['comedy', 'romance', 'family']	[]
Missamma	1955	L. V. Prasad	Two unemployed college graduates from Madras, Rao and Mary act as if they are a married couple to get a job as school teachers in a small village called Appapuram. The story unfolds into an extremely hilarious comedy as they try to cover up that Mary is a christian. They are assisted in their drama by Devaiah-a friend and ex-beggar in fooling the family they work for.	['N.T. Rama Rao', 'Savitri', 'Nageshwara Rao Akkineni', 'Jamuna', 'S. V. Ranga Rao', 'Relangi Venkata Ramaiah', 'Allu Ramalingaiah', 'Rushyendramani', 'Ramana Reddy', 'V Balakrishna', 'Gummadi']	['Vijaya Vauhini Studios']	['India']	[]	['Telugu']	['family', 'drama', 'comedy']	[]
Yatra	2019	Mahi V. Raghav	The film focus especially on the period from 1999-2004 when YSR undertook his famous Padayatra which ultimately proved instrumental in catapulting him to a comprehensive victory in the 2004 polls.	['Mammootty', 'Anasuya Bharadwaj', 'Ashrita Vemuganti', 'Jagapati Babu', 'Mahesh Achanta', 'Nagineedu Vellanki', 'Posani Krishna Murali', 'Rajsekhar Aningi', 'Rao Ramesh', 'Sachin Khedekar', 'Suhasini Maniratnam', 'Vinod Kumar', 'Sri Sudha Bhimireddy', 'Kalpalatha']	['70mm Entertainments']	['India']	[]	['Telugu']	['history']	[]
Jaya Janaki Nayaka	2017	Boyapati Srinu	Gagan is very much in love with Sweety aka Janaki, a sweet-natured girl, ever willing to lend a helping hand to those in need. But she ends up rejecting Gagan and later finds herself in a situation from which there seems no escape. Why did Sweety reject Gagan and what does he do when he finds her in a dangerous predicament.	['Bellamkonda Srinivas', 'Rakul Preet Singh', 'Pragya Jaiswal', 'Jagapati Babu', 'R. Sarathkumar', 'Catherine Tresa', 'Sithara', 'Vani Viswanath', 'Chalapathi Rao', 'Nandu Vijay Krishna', 'Dhanya Balakrishna', 'Suman Talwar', 'Tarun Arora', 'Jayaprakash', 'G. V. Sudhakar Naidu', 'Shashank', 'Amulya', 'Ester Noronha', 'Sravan Raghavendra']	['Dwaraka Creations']	['India']	[]	['Telugu']	['action', 'thriller', 'romance']	[]
Bhamakalapam	2022	Abhimanyu Tadimeti	Anupama, a YouTuber who has over a million subscribers, uploads a new recipe each week. An ancient egg whose value is around Rs 200 crore goes missing from a museum and a murder too happens, and then things take a dark turn. Anupama is also nosy about the happenings in her apartment, she finds herself getting pulled into a tricky situation.	['Priyamani', 'John Vijay', 'Saranya Pradeep', 'Pammi Sai', 'Shanthi Rao', 'Kishore Kumar Polimera', 'Pradeep Rudra', 'Pandian', 'Ravinder Bommakanti', 'Netturi Neeraja', 'M. S. Raaja Rajeshwaran']	['Sri Venkateswara Cine Chitra']	['India']	[]	['Telugu']	['crime', 'comedy', 'thriller']	[]
Bengal Tiger	2015	Sampath Nandi	A happy-go-lucky Aakash who becomes the right hand man of a powerful politician who arranges for him to be married to his daughter Shraddha who falls in love with him, until he reveals the truth that he is already in love with another woman Meera.	['Ravi Teja', 'Tamannaah Bhatia', 'Raashii Khanna', 'Boman Irani', 'Posani Krishna Murali', 'Brahmanandam', 'Sayaji Shinde', 'Tanikella Bharani', 'Pragathi Mahavadi', 'Rama Prabha', 'Brahmaji', 'Prudhviraj', 'Hamsa Nandini', 'Sameer Hasan', 'Harshvardhan Rane', 'Aksha Pardasany', 'Satyam Rajesh', 'Shyamala', 'Fish Venkat', 'Duvvasi Mohan', 'Koti Surya Prabha']	['Sri Satya Sai Arts']	['India']	[]	['Telugu']	['action', 'romance', 'comedy']	[]
Sammathame	2022	Gopinath Reddy	Krishna has big dreams about marriage in the hope that his wife will fill the void left behind from his mother’s passing. But what happens when he falls for a girl who’s nothing like he dreamt of?	['Kiran Abbavaram', 'Chandini Chowdary', 'Goparaju Ramana', 'Chammak Chandra', 'Sithara', 'Annapoorna', 'Rajendran', 'Saptagiri', 'Sivannarayana Naripeddi', 'Duvvasi Mohan']	['UG Productions']	['India']	[]	['Telugu']	['romance', 'comedy']	[]
Gundamma Katha	1962	Kamalakara Kameshwara Rao	Gundamma has two children and a stepdaughter who she mistreats. She hopes to get a son-in-law who will look after the family, but two brothers decide to teach her a lesson.	['N.T. Rama Rao', 'Nageshwara Rao Akkineni', 'S. V. Ranga Rao', 'Savitri', 'Suryakantham', 'Jamuna', 'Ramana Reddy', 'Haranath', 'L. Vijayalakshmi', 'V Balakrishna', 'Rajanala Kaleswara Rao', 'Chaya Devi']	['Vijaya Pictures']	['India']	[]	['Telugu']	['comedy', 'drama']	[]
Sridevi Soda Center	2021	Karuna Kumar	A lightman falls for a girl who runs a soda centre. While love blossoms between the couple, caste prejudice that runs deeply rooted in their town will not allow them to prevail.	['Sudheer Babu', 'Anandhi', 'Naresh', 'Satyam Rajesh', 'Rohini', 'Ajay', 'Raghu Babu', 'Saptagiri', 'Pavel Navageethan', 'Harshavardhan', 'Kalyani Raju']	['70mm Entertainments']	['India']	[]	['Telugu']	['drama', 'romance']	[]
SR Kalyanamandapam	2021	Sridhar Gade	The plot revolves around a family that owns SR Kalyanamandapam, where marriages are conducted from ages. Dharma (the father) fails to take care of the business. Unknown Conflicts occur between the father and the son. Kalyan comes to restore his family’s pride, falls in love with Sindhu. How does Kalyan settle the issues and solve the conflicts?	['Kiran Abbavaram', 'Priyanka Jawalkar', 'Sai Kumar', 'Tulasi', 'Rajsekhar Aningi', 'Srikanth Iyengar', 'Tanikella Bharani', 'Thummala Narasimha Reddy', 'Gangavva']	['Elite Entertainments']	['India']	[]	['Telugu']	['drama', 'comedy', 'romance']	[]
Nijam	2003	Teja	A young man is guided by his mother in a methodical manner to avenge his father against the perpetrators who falsely accused and killed him.	['Mahesh Babu', 'Gopichand', 'Rakshita', 'Prakash Raj', 'Brahmaji', 'Raasi', 'Jayaprakash Reddy', 'Mani Chandana']	['Chitram Movies']	['India']	[]	['Telugu']	['action']	[]
Oka Oori Katha	1977	Mrinal Sen	A father living on the fringes of a village believes that working is a fool's errand, for the lord takes what little the workers make. When a young woman enters their home, tensions begin to rise and their idle life is threatened. The film is based on the story ‘Kafan’ by Munshi Premchand	['G. V. Narayana Rao', 'M. V. Vasudeva Rao', 'Mamata Shankar', 'Pradeep Kumar', 'Krishna A.R.']	['Parandhma Reddy']	['India']	[]	['Telugu']	['drama']	[]
Shankar Dada Zindabad	2007	Prabhu Deva	A goon falls for a girl who manages an old-age home, and she mistakes the goon for a professor. She seeks his help not knowing that the man who wants the old-age home demolished is his boss.	['Chiranjeevi', 'Karishma Kotak', 'Srikanth Meka', 'Sayaji Shinde', 'Brahmanandam', 'Venu Madhav', 'Pawan Kalyan', 'Sadha', 'Ravi Teja', 'Prabhu Deva', 'Yana Gupta', 'Allu Arjun']	['Gemini Film Circuit']	['India']	[]	['Telugu']	['comedy', 'drama']	[]
Munna	2007	Vamsi Paidipally	Munna (Prabhas) is a college student. His aim is to finish off mafia don Kakha (Prakash Raj) who keeps the entire city under his grip. Munna has personal vengeance to take on Kakha. An honest politician Srinivasa Rao (Kota Srinivasa Rao) relentlessly works to expose Kakha but gets killed. Meanwhile, Munna’s classmate Nidhi (Ileana D'Cruz) falls in love with him. The twist in the tale is that Kakha is none other than his estranged father who tries to sell off his mother and was responsible for the death of his mother and his kid sister. Another don in the city named Aatma, who is the opposition of Kakha (Rahul Dev) asks Munna to join him. But Munna refuses his proposal. Munna starts to beat Kakha and the mind game begins. Kakha's second wife and son-daughter left him and join Munna. After some incidents including the death of his best friend, Munna finds out that Aatma was working for Kakha all along.	"['Prabhas', ""Ileana D'Cruz"", 'Prakash Raj', 'Rahul Dev', 'Kota Srinivasa Rao', 'Brahmaji', 'Tanikella Bharani', 'Surya Bhagawan Das', 'Venu Madhav', 'Uttej', 'Shriya Saran', 'Posani Krishna Murali', 'Venu Tillu', 'Sudha', 'Harshavardhan', 'Chalapathi Rao', 'Raghu Babu']"	[]	['India']	[]	['Telugu']	['romance', 'action']	[]
Khadgam	2002	Pasupuleti Krishna Vamsi	After being victims of terrorism, an aspiring actor, a driver and a sincere police officer come together to stop a terrorist from fleeing and put an end to his plans.	['Srikanth Meka', 'Ravi Teja', 'Prakash Raj', 'Sonali Bendre', 'Sangeetha Krish', 'Kim Sharma', 'Uttej', 'Pooja Bharti', 'Shafi', 'Brahmaji', 'Prudhviraj', 'Pavala Shyamala', 'Ahuti Prasad', 'Subbaraju', 'M. S. Narayana', 'Raghu Babu']	[]	['India']	[]	['Telugu']	['drama', 'action']	[]
Srinivasa Kalyanam	2018	Satish Vegesna	The film highlights the sacred bond with another human being through nuptial rituals and the sanctity of the institution of marriage.	['Nithiin', 'Raashii Khanna', 'Nandita Swetha', 'Prakash Raj', 'Jayasudha', 'Annapoorna', 'Sithara', 'Rajendra Prasad', 'Mahesh Achanta', 'Lahari Shari', 'Meena Vasu']	['Sri Venkateswara Creations']	['India']	[]	['Telugu']	['family', 'drama']	[]
Golimaar	2010	Puri Jagannadh	Gangaram (Gopichand), an orphan raised by M.S. Narayana always craves to be a Police Officer and he becomes one. His intensity, dedication and straight forwardness gains him respect from his seniors and soon he starts running a cell that specializes in killing the gang members of two gangs – Talwar Gang and Khaled Gang. How does this honest police officer try to get on top of these gangs forms the rest of the story.	['Gopichand', 'Priyamani', 'Roja Selvamani', 'Nassar', 'Prakash Raj', 'M. S. Narayana', 'Ali Basha']	[]	['India']	[]	['Telugu']	['action', 'crime', 'thriller']	[]
Dubai Seenu	2007	Sreenu Vaitla	Seenu (Ravi Teja) is fondly called as Dubai Seenu. His sole aim in life is to fly to Dubai and earn tonnes of money. In the process, he gets hold of a broker and gets duped by him in Mumbai. He along with his friends starts a small canteen to earn his llivelihood. and eventually falls in love with a girl called Madhumati (Nayana Tara). He then witnesses an incident that prompts him to return back to Hyderabad. The rest of the story is all about how he helps out Madhumati.	['Ravi Teja', 'Nayanthara']	[]	['DVV Entertainment']	[]	['Telugu']	[]	[]
