Lakshmi Narasimha	2004	Jayant Paranji	Lakshmi Narasimha is a strict police officer who does not mind making his own rules to bring justice to the public. Once, he was indirectly affected by the goon Dharma Bhiksham which costs him his sister and lots of properties of his native village. But Dharma Bhiksham does not know that it was Lakshmi Narasimha who got affected by him. After a few months, Lakshmi Narasimha is transferred to Vijayawada. Dharma Bhiksham rules the mafia world from Vijayawada. Though, a strict police officer - he compromises with Dharma Bhiksham and takes bribes to the tune of one and half crores. He takes the bribes and then invests all the money into rehabilitating his native village affected by Dharma Bhiksham. Dharma Bhiksham comes to know about it and rebels against Lakshmi Narasimha. The rest of the story is all about how Lakshmi Narasimha puts an end to the life of Dharma Bhiksham using illegal methods.	['Nandamuri Balakrishna', 'Asin Thottumkal', 'Prakash Raj', 'K. Viswanath', 'Krishna Bhagavan', 'Rakshita']	['Sri Sai Ganesh Productions']	['India']	[]	['Telugu']	['action', 'drama']	[]
Om Shanti	2010	Prakash Dantuluri	Om Shanti (Telugu: ఓం శాంతి) is a 2010 Telugu film directed by Prakash Dantuluri released on 13 January 2010.[1]. It stars Navdeep and Kajal Aggarwal in the lead roles, making it their third film together. Bindu Madhavi, Aditi Sharma, Nikhil Siddharth, and Madhavan play supporting roles. This film released with a lot of hype but failed to make a mark at the box office.	['Navdeep', 'Kajal Agarwal', 'Bindu Madhavi', 'Aditi Sharma', 'Nikhil Siddhartha', 'Murali Mohan', 'Pragathi Mahavadi', 'Tanikella Bharani', 'Suman Shetty', 'Sunil Varma', 'R. Madhavan']	['Vyjayanthi Films']	['India']	[]	['Telugu']	[]	[]
Jaguar	2016	Mahadev	Krishna, a young medical student, strikes against corrupt figures of power as a vigilante and tries to decribes his father's injustice death while trying to win the love of his friend's sister as a college student.	['Nikhil Kumar', 'Jagapati Babu', 'Deepti Sati', 'Rao Ramesh', 'Brahmanandam', 'Aadarsh Balakrishna', 'Ramya Krishnan', 'Sampath Raj', 'Adithya Menon', 'Vidyullekha Raman', 'Avinash', 'Raghu Babu', 'Supreet', 'Kavita Radheshyam', 'Tamannaah Bhatia']	['Channambika Films']	['Telugu']	[]	['Telugu', 'Kannada']	['action']	[]
Snehituda	2009	Satyam Bellamkonda	Sayi and Savithri who are initially at loggerheads but eventually turn out to be the best of friends. However, when their bond goes through a bumpy ride will their friendship sustain?	['Nani', 'Madhavi Latha', 'Nassar', 'Brahmanandam', 'Tanikella Bharani', 'Suthi Velu', 'M. S. Narayana', 'Prudhviraj', 'Gundu Hanumantha Rao', 'Narsing Yadav', 'Duvvasi Mohan', 'Gundu Sudarshan', 'Ananth Babu', 'Subhashini', 'Jenny']	[]	['India']	[]	['Telugu']	['drama', 'romance']	[]
Next Nuvve	2017	Prabhakar Podakandla	Kiran and his girlfriend Smita decide to turn the former's ancestral property into a hotel to pay off their loans. They do it with the help of his father's aide Sarat and sister Rashmi . But, the house seems to be haunted, or is it really?	['Aadi Saikumar', 'Vaibhavi Shandilya', 'Brahmaji', 'Rashmi Gautham', 'Jayaprakash Reddy', 'Raghu Karumanchi', 'Srinivas Avasarala', 'Posani Krishna Murali', 'L. B. Sriram', 'Prudhviraj', 'Himaja']	['V4 Movies']	['India']	[]	['Telugu']	['comedy', 'horror']	[]
1st Rank Raju	2019	Naresh Kumar H. N.	Raju, an engineering student is obsessed with academics until he is thrown into the real world where he stumbles and tries to learn some very important life lessons.	['Chetan Maddineni', 'Kashish Vohra', 'Brahmanandam', 'Naresh', 'Posani Krishna Murali', 'Prakash Raj', 'Priyadarshi Pullikonda', 'Rao Ramesh', 'Tanikella Bharani', 'Vennela Kishore']	['Dolphin Entertainment']	['India']	[]	['Telugu']	[]	[]
Devi	1999	Kodi Ramakrishna	Devi, a snake goddess, stays on earth to protect the girl whose father saved her life from greedy relatives and from the snake demon, Dantra.	['Prema', 'Abu Salim', 'Mahendran', 'Shiju']	['Sumanth Art Productions']	['India']	[]	['Telugu']	[]	[]
Naaga	2003	D.K. Suresh	A man wages a battle against politicians and their dishonourable ways of campaigning when some political goons harm his father and sister due to a trivial issue.	['N. T. Rama Rao Jr.', 'Raghuvaran', 'Sadha', 'Nassar', 'Jennifer Kotwal', 'Rajan P Dev', 'Shakeela', 'Sudeepa Pinky', 'M. S. Narayana', 'Venu Madhav', 'Sunil Varma', 'Rajiv Kanakala', 'Anasuya Bharadwaj', 'Tanikella Bharani']	['Sri Surya Movies']	['India']	[]	['Telugu']	['action', 'drama']	[]
Dorasaani	2019	KVR Mahendra	Set in rural Telangana, A commoner dares to fall in love with a dorasaani named Devaki. Will their love survive despite the class differences?	['Anand Deverakonda', 'Shivathmika', 'Kishore', 'Saranya Pradeep', 'Vinay Varma']	['Big Ben Productions', 'Madhura Entertainment', 'Suresh Productions']	['India']	[]	['Telugu']	[]	[]
Ye Mantram Vesave	2018		Nikky is an irresponsible and insensitive gaming addict. Rags enters his life and challenges him to find her by playing a game designed by her. But things seem to be much more than just fun and games.	['Vijay Deverakonda', 'Shivani Singh', 'Raviteja', 'Meesam Suresh']	[]	['India']	[]	['Telugu']	['romance', 'thriller']	[]
Vijetha	1985	A. Kodandarami Reddy	Chinnababu realizes that despite having well-earning sons his father is struggling to fund his younger sister's wedding. In order to help him, Chinnababu takes a drastic step.	['Chiranjeevi', 'Bhanupriya', 'Somayajulu J V', 'Kaikala Satyanarayana', 'Sharada', 'Giri Babu', 'Nutan Prasad', 'Ranganath', 'Allu Ramalingaiah', 'Allu Arjun', 'Jandhyala Subramanya Sastry']	[]	['Geetha Arts']	[]	['Telugu']	['family']	[]
Malli Modalaindi	2022	T. G. Keerthi Kumar	After their divorce, Vikram starts dating Nisha’s divorce lawyer, Pavithra. But can Vikram handle the situation when his newfound casual love turns serious?	['Sumanth', 'Naina Ganguly', 'Suhasini Maniratnam', 'Varshini Sounderajan', 'Pavani Reddy', 'Prudhviraj', 'Annapoorna', 'Manjula Ghattamaneni', 'Posani Krishna Murali', 'Vennela Kishore']	['Red Cinemas']	['India']	[]	['Telugu']	['romance', 'comedy', 'family']	[]
Ice Cream	2014	Ram Gopal Varma	A fragile young woman, who is obsessed with eating ice cream, is dropped off by her lover at a haunted house. Terrified by the paranormal events in the house, she gets into a nightmare she may never get out of.	['Navdeep', 'Tejaswi Madivada', 'Sandeepthi']	['Bheemavaram Talkies']	['India']	[]	['Telugu']	['horror', 'romance']	[]
Soggadu	2005	Ravi Babu	Ravi likes Swati and helps her escape from her wedding, only to realise that she likes Chandu. He decides to sacrifice his love and unite Swati with her lover.	['Tarun', 'Aarthi Agarwal', 'Brahmanandam', 'Ali Basha', 'M. S. Narayana', 'Kota Srinivasa Rao', 'Subbaraju', 'Hema', 'Jeeva', 'Shriya Saran', 'Venkatesh', 'Sunil Varma']	['Suresh Productions']	['India']	[]	['Telugu']	['romance', 'comedy']	[]
Ninne Premistha	2000	R.R. Shinde	A young man meets with an accident and loses his eyesight; three months later he recovers and goes back to his job. He meets a lady who is very affectionate towards him; But why?	['Srikanth Meka', 'Soundarya', 'Rajendra Prasad', 'Nagarjuna Akkineni', 'K. Chakravarthy', 'Brahmanandam', 'Chandramohan', 'M. S. Narayana', 'Tanikella Bharani', 'Nutan Prasad', 'Chalapathi Rao', 'Shivaji Raja', 'L. B. Sriram', 'Ali Basha', 'Ananth Babu', 'Kallu Chidambaram', 'Ravali', 'Annapurna', 'Sangeeta', 'Jenny', 'Venniradai Nirmala', 'Tanish Alladi']	[]	['India']	[]	['Telugu']	['romance']	[]
Hare Ram	2008	Swarna Subba Rao	Hari and Ram, conjoined twins separated at birth, grow up separately when their parents part ways. Hari becomes a sincere cop while the mentally unstable Ram becomes a violent man who would barely hesitate to kill anyone considering themselves smarter than him.	['Kalyan Ram', 'Priyamani', 'Kota Srinivasa Rao', 'Brahmanandam', 'Sindhu Tolani', 'Ali Basha', 'Raghu Babu']	['N. T. R. Arts']	['India']	[]	['Telugu']	['thriller', 'action']	[]
Kshemanga Velli Labhamga Randi	2000	Raja Vannem Reddy	Three mechanics in a car company are wayward husbands. Their weakness lies in drinking and spending half of their salary on the unnecessary items. Their wives have a tough time running their houses with the meager money provided by their men. Their world is turned upside down by a couple who move in next door.	['Srikanth Meka', 'Brahmanandam', 'Rajendra Prasad', 'Roja Selvamani', 'Ramya Krishnan', 'Prakash Raj', 'Kovai Sarala']	[]	['India']	[]	['Telugu']	['comedy']	[]
Gokulamlo Seetha	1997	Muthyala Subbaiah	Kalyan (Pawan Kalyan) is a careless and spoiled brat of a rich man Muddu Krishnayya (Kota Srinivasa Rao). Kalyan has every weakness that a rich and careless youth can have, and Baburao (sudhakar) helps him in all his activities.	['Pawan Kalyan', 'Raasi', 'Kota Srinivasa Rao', 'Sudhakar', 'Srihari', 'Harish Kumar']	[]	['Telugu']	[]	['Telugu', 'Tamil']	['romance', 'drama']	[]
Prathinidhi	2014	Prashanth Mandava	n the starting scene, a common man kidnaps Chief Minister of Andhra Pradesh in a private old age home event in Hyderabad. News goes viral and everyone from Local to Central cabinet starts taking the issue personally. Home Minister appoints Police Commissioner (Posani Krishna Murali) for rescuing CM. He get hold of Srikar(Vishnu) who helped him kidnap CM. Srikar explains how he met Manchodu Srinu(Nara Rohit) and sunaina to Commissioner. As cops strive to get clues about kidnapper, Seenu comes out with whacky yet valid demands that mostly deals with Indian currency and economy. The rest of story is all about the background of Seenu and why he has kidnapped CM.	['Nara Rohith', 'Shubra Aaiyappa', 'Giri Babu', 'Kota Srinivasa Rao', 'Posani Krishna Murali', 'Ravi Prakash', 'Ranganath', 'Jayaprakash Reddy']	['Sudha Cinema']	['India']	[]	['Telugu']	['drama']	[]
Vijayendra Varma	2004	Swarna Subba Rao	An un-named man (Bala Krishna) lives with his wife (Laya), daughter and in-laws. He does not have a name nor does he know who he is. He cannot remember anything that has happened 7 years before. However, he realizes that he possesses special combat skills whenever he comes across evil elements. When he forces his wife to tell the truth, she reveals that he was found in river in a mutilated state and he was taken care of by her. As the man goes to Hyderabad searching for his identity, a few incidents lead to the answer. He discovers that he is none other than the most respected and committed Indian Army Officer, Vijayendra Varma. The rest of the story is about how he retraces his past and saves the nation from Pakistani Jihadis.	['Nandamuri Balakrishna', 'Laya', 'Ankitha', 'Mukesh Rishi', 'Ashish Vidhyarthi', 'Chalapathi Rao', 'M. Balayya', 'Brahmanandam', 'M. S. Narayana', 'Venu Madhav', 'Manorama', 'Narra Venkateswara Rao', 'Raghu Babu', 'Giri Babu', 'Sudhakar']	[]	['India']	[]	['Telugu']	['drama']	[]
Krishnarjuna	2008	P. Vasu	Influenced by an astrologer, Pedababu fixes his sister's wedding with Arjun, an orphan, and plans to get him killed. However, Lord Krishna comes to Arjun's rescue.	['Nagarjuna Akkineni', 'Mamta Mohandas', 'Vishnu Manchu', 'Nassar', 'Mohan Babu', 'Dev Gill', 'Brahmanandam', 'Sunil Varma', 'Venu Madhav', 'M. S. Narayana', 'Tanikella Bharani', 'Raghu Babu', 'Srinivasa Reddy', 'Mallikarjuna Rao', 'Giri Babu', 'Satyam Rajesh', 'Napoleon', 'Manorama', 'P. Vasu', 'Vamsi Krishna', 'Gundu Hanumantha Rao', 'Prema', 'Bhuvaneswari', 'Surekha Vani']	['Sree Lakshmi Prasanna Pictures']	['India']	[]	['Telugu']	['comedy', 'family', 'drama', 'romance']	[]
Anthuleni Katha	1976	K. Balachander	Saritha sacrifices her comforts and the prospect of a life with her boyfriend for the sake of her family. Things take a turn when her boss proposes to marry her.	['Jaya Prada', 'Rajinikanth', 'Sripriya', 'Fatafat Jayalakshmi', 'G. V. Narayana Rao', 'Prasad Babu', 'Pradeep Shakti', 'Kamal Haasan']	[]	['India']	[]	['Telugu']	['drama', 'family']	[]
Aa Intlo	2009	Chinna		['Chinna', 'Flora Saini', 'Vinod Kumar', 'Devan', 'Jhansi', 'Kota Srinivasa Rao', 'Ahuti Prasad', 'Subbaraya Sharma', 'Dharmavarupu Subramanyam', 'Devna pani']	[]	['India']	[]	['Telugu']	['horror', 'drama']	[]
Heads & Tales	2021	Sai Krishna Enreddy	As three women deal with tough times in their romantic relationships, they learn to take control of their personal lives and stand up for themselves.	['Sunil Varma', 'Sri Vidya Maharshi', 'Divya Sripada', 'Suhas', 'Tarun Ponugoti', 'Chandni Rao', 'Arun Pulavarthi', 'Kivish Kautilya', 'Sai Krishna Enreddy', 'Vara Kodali', 'Kodati Pavan Kalyan']	['ZEE5']	['India']	[]	['Telugu']	['fantasy', 'drama']	[]
Gouravam	2013	Radha Mohan	Arjun begins a search for Shanmugam, his friend who had eloped with his lover from his village, and uncovers shocking truths...	['Allu Sirish', 'Yami Gautam', 'Prakash Raj', 'Nassar', 'Anupama Kumar', 'Harish Uthaman', 'Elango Kumaravel', 'Brahmaji', 'Lakshmi Priyaa', 'Sricharan', 'L. B. Sriram', 'Pavitra Lokesh', 'Kaajal Pasupathi', 'Ashwin Kumar']	['Duet Movies']	['India']	['Telugu']	['Telugu', 'Tamil']	['drama', 'family']	[]
90ML	2019	Sekhar Reddy Yerra	An alcoholic who drinks 90ml of alcohol, three times a day, falls in love with a physiotherapist whose family would never approve of him and his habit.	['Kartikeya Gummakonda', 'Neha Solanki', 'Ajay', 'Ali Basha', 'Duvvasi Mohan', 'Posani Krishna Murali', 'Ravi Kishan', 'Rao Ramesh']	[]	['Kartikeya Creations Works']	[]	['Telugu']	['romance']	[]
Aaradugula Bullet	2021	B. Gopal	Siva is a careless youth who loves his family to death. But his father hates the fact that Siva is aimless in life. Siva falls in love with Nayana and just when things seem to be going fine, a dreaded don grabs the land of Siva’s father.	['Gopichand', 'Nayanthara', 'Prakash Raj', 'Brahmanandam', 'Abhimanyu Singh', 'Kota Srinivasa Rao', 'Sandhya Janak', 'Uttej', 'Jeeva', 'Jayaprakash Reddy', 'Chalapathi Rao', 'Rama Prabha', 'Salim Baig', 'Surekha Vani', 'Sana', 'Madhunandan', 'Feroz Abbasi', 'Anand Ramaraju', 'M. S. Narayana']	['Jaya Balaji Real Media']	['India']	[]	['Telugu']	['action', 'drama', 'family']	[]
Anthaka Mundu Aa Tarvatha	2013	Mohana Krishna Indraganti	Anil (Sumanth Ashwin) is a happy go lucky guy from a town. Ananya (Eesha) is an independent girl from Hyderabad whose parents are going through arguments. Anil and Ananya meet at a mutual friend’s wedding and become friends. Ananya is good with creative greeting cards. Anil has some business ideas and they start a new company and they fall in love. But both of them are afraid of committing to each other due to the experience of their parents. Hence they want to test their compatibility by living together in a secret place. The rest of the story is all about what they learn from it.	['Sumanth Ashwin', 'Eesha Rebba', 'Rao Ramesh', 'Ravi Babu', 'Srinivas Avasarala', 'Madhoo', 'Rohini']	[]	['India']	[]	['Telugu']	['drama', 'romance']	[]
Anandam	2001	Sreenu Vaitla	Two neighbors study in the same college, but hate each other immensely. A series of events changes their feelings when they unknowingly write to each other under alias names.	['Jai Akash', 'Rekha Vedavyas', 'Tanu Roy', 'Chandramohan', 'Tanikella Bharani', 'Dharmavarupu Subramanyam', 'Brahmanandam', 'Chitram Seenu', 'Siva Reddy', 'Sudha', 'M. S. Narayana', 'Jayaprakash Reddy', 'Banerjee', 'Shweta Menon', 'Jenny', 'Shankar Melkote']	['Ushakiran Movies']	['India']	[]	['Telugu']	['romance']	[]
Chikati Gadilo Chithakotudu	2019	Santhosh P. Jayakumar	A comedy drama film directed by Santhosh P Jayakumar, starring Adith Arun in the lead role.	['Thrigun', 'Nikki Tamboli', 'Bhagyashree Mote', 'Sayantani Guhathakurta', 'Posani Krishna Murali', 'Rajendran', 'Jangiri Madhumitha', 'Raghu Babu', 'Chandrika Ravi']	['Blue Ghost Pictures']	['India']	[]	['Telugu']	['romance', 'comedy', 'horror']	[]
Allari Bullodu	2005	K Raghavendra Rao	When a wealthy businessman meets with an accident, his daughter takes over his company. Trisha's skills are tested when she has to spot the imposter, who is out to destroy her father's company.	['Nithiin', 'Trisha Krishnan', 'Rathi Arumugam', 'Krishna Bhagavan', 'Jayalalita']	[]	['India']	[]	['Telugu']	['comedy']	[]
Dharma Chakram	1996	Suresh Krishna	The story is about a family in which mother and son together fight against father for the principles and human values. Srividhya, as a ditched wife, rises up her kid Rakesh (Venkatesh) with well behavior, manner and makes him a good lawyer to do justice to the fellow woman who are cheated brutally by their husbands. How Rakesh takes the revenge on his father for the injustice that he had done to his mother is the crux of the film.	['Venkatesh', 'Prema', 'Ramya Krishnan', 'Girish Karnad', 'Srividya', 'Brahmanandam', 'Amanchi Venkata Subrahmanyam', 'Somayajulu J V']	[]	['India']	[]	['Telugu']	['drama']	[]
Amma Rajyam Lo Kadapa Biddalu	2019	Ram Gopal Varma	Amma Rajyam Lo Kadapa Biddalu (Kadapa Children in Mother's Kingdom) is a political satire film directed by Ram Gopal Varma and Siddartha Thatolu. It explores caste, dynasties, religion and their influence on politics in Andhra Pradesh, India.	['Ajmal Ameer', 'Aashikka Meka', 'Brahmanandam', 'Dhanraj Sukhram', 'Kathi Mahesh', 'Prudhviraj', 'Dhananjay Prabhune', 'Arvind Rau', 'Dheeraj Kv', 'Gandham Ramu', 'Jaffar Babu', 'Ali Basha', 'Swapna', 'Srikanth Iyengar']	['TigerProduction', 'Ajay Mysore Productions']	['India']	[]	['Telugu']	['drama', 'thriller']	[]
Gaalodu	2022	Raja Sekar Reddy Pulicharla	Raju, a reckless guy from a village, escapes to Hyderabad after a fight with a local leader’s son. Raju saves  Shukla ,a good hearted wealthy girl  from some thugs. Shukla introduces Raju to her father and hires him as a driver. And so their acquaintance leads to love.	['Sudigali Sudheer', 'Gehna Sippy', 'Saptagiri', 'Shakalaka Shankar', 'Satya Krishnan', 'Prudhviraj']	['Samskruthi Films']	['India']	[]	['Telugu']	['romance', 'action']	[]
Anaganaga O Athidhi	2020	Dayal Padmanabhan	Subbaiah and his family live in abject poverty and a soothsayer tells them that their fortune will change overnight. The peace in the house is stirred when a stranger knocks on their door seeking shelter for a night, and the consequences are deadly.	['Payal Rajput', 'Chaitanya Krishna', 'Darbha Appaji Ambarisha', 'Chakrapani Ananda', 'Veena Sundar', 'Venu Tillu', 'Thotapalli Madhu', 'Naveen Krishna', 'Bekkam Ravinder', 'Srilakshmi']	['Trend Loud']	['India']	[]	['Telugu']	['thriller', 'drama']	[]
Athili Sathibabu LKG	2007	E.V.V. Satyanarayana	Athili Sathibabu (Allari Naresh) is stingy guy & a ruthless money lender charging high rate of interest at Rs.10 at every 100 on a daily interest rate. He gives preferences to money over relations & love. He goes to extent of buying his brothers share of ancestral property & then drive them away. He falls in love with beautician (Kausha) by ignoring a village belle (Vidisha) who falls head over heel for him. The rest of the story is all about how he realizes the importance of love & relationships.	['Allari Naresh', 'Kausha Rach', 'Vidisha', 'Brahmanandam', 'Sunil Varma', 'Venu Madhav', 'Dharmavarupu Subramanyam', 'Ali Basha', 'Babu Mohan', 'Krishna Bhagavan', 'M. S. Narayana', 'Mallikarjuna Rao', 'Chalapathi Rao', 'L. B. Sriram', 'Raghu Babu', 'Kondavalasa Lakshmana Rao', 'Lakshmipati', 'Kadambari Kiran', 'Duvvasi Mohan', 'Srinivasa Reddy', 'Uttej', 'Kallu Krishna Rao', 'Maharshi Raghava', 'Abhinaya Sri']	[]	['India']	[]	['Telugu']	['comedy']	[]
Vijetha	2018	Rakesh Shashi	Srinivasa Rao, who is a talented photographer sacrifices his passion and keeps his family before everything. But his son Ram doesn’t understand this and keeps wasting time by chilling with his friends. An unexpected twist creates a massive rift between the father and son. Rest of the story is as to how Ram becomes responsible in life and wins his father’s respect back.	['Kalyaan Dhev', 'Malavika Nair', 'Murali Sharma', 'Prudhviraj', 'Tanikella Bharani', 'Nassar', 'Jayaprakash', 'Rajiv Kanakala', 'Nellore Sudharshan', 'Gayatri Bhargavi', 'Kireeti Damaraju']	['Vaaraahi Chalana Chitram']	['India']	[]	['Telugu']	['drama', 'romance', 'action']	[]
Naa Bangaaru Talli	2013	Rajesh Touchriver	The film was co-produced by M. S. Rajesh and Dr. Sunitha Krishnan, an internationally known anti-trafficking crusader. It explores the consequences of sex trafficking, testing the vulnerability of trust in human relations.	['Siddique', 'Anjali Patil', 'Rathna Shekar Reddy', 'Lakshmi Menon', 'Neena Kurup', 'Anoop Aravindan']	[]	['India']	[]	['Telugu']	['crime', 'drama']	[]
Rajendrudu Gajendrudu	1993	S.V. Krishna Reddy	Rajendra wins a lottery and the prize is an elephant. Despite being poor, he chooses to keep the animal. What follows is a unique bond of love between a man and an animal.	['Rajendra Prasad', 'Soundarya', 'Brahmanandam', 'Kota Srinivasa Rao', 'Babu Mohan', 'Mallikarjuna Rao', 'Gundu Hanumantha Rao', 'Gummadi', 'Vidya Sagar', 'Ironleg Sastri', 'Narsing Yadav', 'Gautam Raju']	[]	['India']	[]	['Telugu']	[]	[]
Rechipo	2009	Murali Paruchuri	Siva (Nitin) is a thief. He robs the Peter to pay Paul on the lines of Robin hood. He always robs the black money from rich persons and spends it for the education of orphans and for a good cause. Siva robs Rs 500 crores from the Home Minister's house. While escaping under disguise he meets Krishnaveni (Ileana) and both fall in love. The rest of the story takes twists and turns where Krishnaveni is kidnapped by the mafia later to be saved by Siva.	"['Nithiin', ""Ileana D'Cruz"", 'Ahuti Prasad', 'Bhanuchander', 'Raghu Babu', 'Venu Madhav', 'Hema', 'M. S. Narayana', 'Tanikella Bharani', 'Sunil Varma', 'Shawar Ali', 'Rama Prabha']"	[]	['India']	[]	['Telugu']	['romance', 'action']	[]
Om Namo Venkatesaya	2017	K Raghavendra Rao	Raama, who is a devotee of Lord Venkateswara, denounces worldly pleasures including his soon-to-be-bride and maradalu Bhavani and ends up at Tirumala. He decides to change the face of Tirumala by turning it into ‘Kaliyuga Vaikuntham’ both for pilgrims and the deity with the help of Krishnamma. His endeavours to do so, the hurdles and his encounters with the Lord himself is the story.	['Nagarjuna Akkineni', 'Anushka Shetty', 'Jagapati Babu', 'Sourabh Raaj Jain', 'Sai Kumar', 'Brahmanandam', 'Vimala Raman', 'Rao Ramesh', 'Sampath Raj', 'Tanikella Bharani', 'Pragya Jaiswal', 'Ashmitha Subramaniyam']	['Sai Krupa Entertainment']	['India']	[]	['Telugu']	['drama']	[]
Ardha Shathabdham	2021	Rawindra Pulle	After five decades of Independence, India's rural landscape still throws up unanswerable questions. Can a love story bring a revolution? Witness this earthy love story set in the early 2000s.	['Karthik Rathnam', 'Naveen Chandra', 'Subhalekha Sudhakar', 'Pavitra Lokesh', 'Suhas']	[]	['India']	[]	['Telugu']	['drama']	[]
Subbu	2001	Rudraraju Suresh Varma	Subbu, a college student, falls in love with the affluent Neeraja. However, things take a turn when he realises that Neeraja's father was responsible for the death of his entire family.	['N. T. Rama Rao Jr.', 'Sonali Joshi', 'Brahmanandam', 'Amanchi Venkata Subrahmanyam', 'Dharmavarupu Subramanyam']	['R S Productions']	['India']	[]	['Telugu']	['drama', 'romance']	[]
Kushi	2023	Shiva Nirvana		['Vijay Deverakonda', 'Samantha Ruth Prabhu', 'Jayaram', 'Sachin Khedekar', 'Murali Sharma', 'Rohini', 'Vennela Kishore', 'Rahul Ramakrishna', 'Srikanth Iyengar', 'Saranya Pradeep', 'Ali Basha', 'Lakshmi']	['Mythri Movie Makers']	['India']	[]	['Telugu']	['romance', 'drama']	[]
Ishq	2021	S.S. Raju	A young couple, are mentally and physically harassed by two men while on a road trip. However, the situation puts their love to the test, making them go their separate ways.	['Teja Sajja', 'Priya Prakash Varrier', 'Ravindra Vijay', 'Leona Lishoy', 'Pramodini Pammi', 'Jabardasth Shaking Seshu', 'Lakkimsetty Nageswara Rao']	[]	['India']	[]	['Telugu']	['romance', 'thriller']	[]
Bejawada	2011	Vivek Krishna	A fearless young man sets out to avenge his brother's death by eliminating the devious criminals responsible for the murder. In the process, he must also fight for justice and save the labourers' and students' unions from the gangster's ruthless tyranny. Will he succeed in his mission?	['Naga Chaitanya Akkineni', 'Amala Paul', 'Prabhu', 'Subhalekha Sudhakar', 'Abhimanyu Singh', 'Mukul Dev', 'Kota Srinivasa Rao', 'Ajay', 'Ahuti Prasad']	['Shreya Production']	['India']	[]	['Telugu']	['action', 'crime', 'drama']	[]
Hero	2008	G. V. Sudhakar Naidu	As per a new rule, any person can join the police force. Many people including Krishnaveni, a simple girl, and Radhakrishna join. Both fall in love too. Soon it is revealed that Krishna is a naxalite.	['Nithiin', 'Bhavana', 'Brahmanandam', 'Ali Basha', 'Ramya Krishnan', 'Kota Srinivasa Rao', 'Nagendra Babu', 'Kovai Sarala', 'Tanu Roy', 'Mohan Babu', 'Ajay', 'Narsing Yadav', 'Naresh', 'Satyam Rajesh', 'Sameer Hasan', 'Fish Venkat', 'Vizag Prasad', 'Jogi Naidu']	[]	['India']	[]	['Telugu']	['action', 'romance']	[]
Tiger	2015	Vi Anand	Tiger, an aggressive young man, can do just about anything for his best friend Vishnu. When Vishnu falls in love with Ganga, the lives of the lovers are in danger. Will Tiger be able to save them?	['Sundeep Kishan', 'Rahul Ravindran', 'Seerat Kapoor', 'Tanikella Bharani', 'Nagendra Babu', 'Praveen', 'Venu Tillu', 'Fish Venkat', 'Raghu Karumanchi', 'Saandip', 'Y. Kasi Viswanath', 'Thagubothu Ramesh', 'Saptagiri']	['NVR Cinema']	['India']	[]	['Telugu']	['thriller', 'romance', 'action']	[]
