Raithu Bidda	1939	Gudavalli Ramabrahmam	Ramabrahmam's best-known work is a seminal reformist melodrama critiquing the zamindari system from the viewpoint of the Kisan Sabha agitations in rural A.P.	['Bellary Raghava', 'Gidugu Venkata Seethapathi', 'Bhimavarapu Narasimha Rao', 'P. Suri Babu', 'Tanguturi Suryakumari', 'Commuri Padmavathidevi']	['Saradhi Studios']	['India']	[]	['Telugu']	[]	[]
Thaggedhe Le	2022	Srinivasa Raju	Inspector Chellappa is on the verge of busting the drug mafia in the city and waits for the right moment. Meanwhile, a corporate man gets entangled with the world of drugs and later becomes a suspect in a murder case. Simultaneously, the D-gang from Dandupalyam returns with a vengeance.	['Naveen Chandra', 'Divya Pillai', 'Ananya Raj', 'Naina Ganguly', 'Makrand Deshpande', 'P. Ravi Shankar', 'Nagendra Babu', 'Ravi Kale', 'Ayyappa P. Sharma', 'Pooja Gandhi', 'Raja Ravindra', 'Danny Kuttappa', 'Mahesh Achanta', 'Munish Raja', 'Petrol Prasanna', 'Chitram Seenu']	['Bhadra Productions']	['India']	[]	['Telugu']	['thriller', 'crime']	[]
Emo Gurram Egaravachu	2014	Chandra Siddhartha	Emo Gurram Egaravachu is a 2013 Telugu romantic comedy directed by Chandra Siddhartha. It is also known by its abbreviation EGE. It features Sumanth and Pinky Sawika Chaiyadech in the lead roles.	['Sumanth', 'Savika Chaiyadej', 'Thagubothu Ramesh', 'Pavala Shyamala', 'Annapoorna', 'S.S. Kanchi']	['Cherry films']	['India']	[]	['Telugu']	[]	[]
Galipatam	2014	Naveen Gandhi	Karthik is married to Swathi and both of them are unhappy. Karthik has a lover before marriage with whom he has differences which results in him marrying Swathi. Swathi doesn’t believe in marriage, hence she rejects a guy before marriage. Karthik and Swathi make a decision to part their ways amicably as the official divorce might take an year. The rest of the story is all about whether they follow their heart or continue their marriage of convenience.	['Aadi Saikumar', 'Rahul Ravindran', 'Posani Krishna Murali', 'Erica Fernandes', 'Kristina Akheeva', 'Bharath Reddy', 'Gayatri Bhargavi', 'Rekha', 'Pragathi Mahavadi', 'Chammak Chandra', 'Hema', 'Sivannarayana Naripeddi']	[]	['India']	[]	['Telugu']	['romance', 'drama', 'family']	[]
Vijayadasami	2007	V. Samudra	A welder must confront his evil brother who ruined his life in childhood.	['Kalyan Ram', 'Sai Kumar', 'Vedhika', 'Suman Talwar', 'Jayasudha', 'Brahmanandam', 'Srinivasa Reddy', 'Sravan Raghavendra']	['Sai Sarvajit Movies']	['India']	[]	['Telugu']	['action']	[]
Anumanaspadam	2007	Vamsy		['Aryan Rajesh', 'Hamsa Nandini', 'Jayaprakash Reddy', 'Tanikella Bharani', 'Vanitha Reddy', 'Jeeva', 'M. S. Narayana', 'Devi Charan']	[]	['India']	[]	['Telugu']	['mystery', 'comedy', 'thriller']	[]
Pekata Paparao	1993	Y Nageswara Rao	An irresponsible man, who does not care about his family members and is addicted to gambling, spends most of his time at the club. He falls in love with a woman and marries; later finds out that she is a cop.	['Brahmanandam', 'Ali Basha', 'Tanikella Bharani', 'Nirmalamma', 'Rajendra Prasad', 'Khushboo']	[]	['India']	[]	['Telugu']	['comedy']	[]
Pelli Naati Pramanalu	1959	Kadri Venkata Reddy	Bheemasena Rao (SV Rangarao) is a dignified and respectful man. His son (R. Nageswara Rao) works in Military services. His daughter is Rukmini (Jamuna). His close friend and relative Salahala Rao (Ramana Reddy) is trying to arrange marriage to his daughter. Krishna Rao (Akkineni) is his relative of Salahala Rao. He was sent to meet Bheemasena Rao with recommendation letter. During the meantime he attracts Rukmini with his good manners.	['Nageshwara Rao Akkineni', 'Jamuna', 'S. V. Ranga Rao', 'Raja Sulokshana', 'Rajanala Nageswara Rao', 'M. N. Nambiar', 'Ramana Reddy', 'Chhaya Devi', 'Allu Ramalingaiah', 'Chadalavada']	['India']	['Telugu']	[]	['Telugu', 'Tamil']	[]	[]
BRO	2023	Samuthirakani		['Pawan Kalyan', 'Sai Dharam Tej', 'Ketika Sharma', 'Priya Prakash Varrier', 'Subbaraju', 'Brahmanandam', 'Tanikella Bharani', 'Rohini', 'Raja Chembolu']	['People Media Factory', 'Pawan Kalyan Creative Works', 'Fortune Four Cinemas', 'Zee Studios']	['India']	[]	['Telugu']	['fantasy', 'comedy', 'drama']	[]
Asvins	2023	Tarun Teja Mallareddy	A group of Youtubers who accidentally unleash a 1500-year-old evil that crosses over from the realm of darkness to the human world.	['Vasanth Ravi', 'Vimala Raman', 'Saras Menon', 'Muralidaran', 'Udayaraj', 'Simran Pareek']	['Sri Venkateswara Cine Chitra']	['India']	[]	['Telugu']	['thriller', 'horror', 'mystery']	[]
Back Bench Student	2013	Madhura Sridhar Reddy	Karthik (Mahat Raghavendra) is a careless Engineering student, who is least bothered about his studies the result of which is 16 backlogs. He is in love with his classmate Priyanka (Archana Kavi), who splits from him and leaves for USA to pursue MS. The hell breaks loose when his parents (Sarath Babu and Pragathi) come to know about the backlogs.	['Mahat Raghavendra', 'Pia Bajpiee', 'Archana Kavi', 'Brahmanandam', 'Sarath Babu', 'Ali Basha', 'Pragathi Mahavadi', 'Banerjee', 'Insi Gutta']	['Shirdi Sai Combines']	['India']	[]	['Telugu']	[]	[]
Devaraya	2012	Nani Krishna	Dorababu (Srikanth) is a filthy rich guy who spends his entire time enjoying with his friends in his village. Dorababu tried to lure Swapna (Vidisha), who is a well educated and comes to village to see her grandfather (Ranganath). In this process, Swapna falls for Srikanth and make him understand her love for him. Though Swapna's grandfather is reluctant to agree for the marriage, later on he gives nod for the marriage. All of a sudden everyone comes to know that Dorababu is going to die and this surprises everyone. What is the secret beyond Dorababu ? How is Dorababu related to Sri Krishna Devaraya? All these incidents form the rest of the story	['Srikanth Meka', 'Meenakshi Dixit', 'Vidisha']	[]	['India']	[]	['Telugu']	['comedy']	[]
Naa Oopiri	2005	Kanmani	Naa Oopiri (transl. My breath) is a 2005 Telugu language film directed by Kanmani and starring Vadde Naveen, Sangeetha, and Anjana in the lead roles. Upon release, the film was also dubbed in Tamil.[1] This film marks the Telugu debut of Anjana, Kanmani, Deepak Dev (in his only Telugu album to date), and Suresh Urs.	['Vadde Naveen', 'Sangeetha Krish', 'Anjana Sukhani', 'Sudha', 'M. S. Narayana', 'Gundu Hanumantha Rao', 'Surya Bhagawan Das']	[]	['India']	[]	['Telugu']	['family', 'drama']	[]
Voter	2019	Karthik Reddy	Gautam is an NRI who returns to India to cast his vote. When challenged by the woman he loves, Bhavana, to make a politician fulfil his campaign promises if he wants to win her over, Gautam sets off on a path to change the system.	['Vishnu Manchu', 'Surbhi', 'Posani Krishna Murali', 'Brahmaji', 'Supreet', 'Nassar', 'Sampath Raj', 'Slim Khezri', 'Pragathi Mahavadi', 'Praveen', 'Sravan Raghavendra', 'Jayaprakash']	['Rama Reels']	['India']	[]	['Telugu']	['action', 'family', 'drama', 'crime']	[]
Rakshana	1993	Narayana Rao Uppalapati	Sriram Bose, a righteous policeman, relentlessly fights against the underworld gangster Salim Ghouse. When Salim murders his friend, Nassar, and kidnaps his daughter, Bose tries to rescue her.	['Nagarjuna Akkineni', 'Shobana']	[]	['India']	[]	['Telugu']	['romance', 'action']	[]
Vamsodharakudu	2000	Sarath	Suryam is a physical director in a local college and lives with his mother Varalakshmi, a widow. The college in which Suryam work belongs to an Industrialist called Sudarshan Rao.	['Nandamuri Balakrishna', 'Krishnam Raju', 'Ramya Krishnan', 'Sakshi Shivananda', 'Charan Raj', 'Srihari', 'Brahmaji', 'Ravi Babu', 'Brahmanandam', 'Babu Mohan', 'M. S. Narayana', 'Chalapathi Rao', 'Giri Babu', 'Radhika Sarathkumar', 'Rama Prabha', 'Jayalalita', 'Varsha', 'Mamilla Shailaja Priya', 'Srilakshmi', 'Kalpana Rai', 'Y. Vijaya', 'Surya Bhagawan Das', 'Pithamagan Mahadevan']	['Gayatri Films']	['India']	[]	['Telugu']	['romance', 'drama']	[]
Rowdy Inspector	1992	B. Gopal		['Nandamuri Balakrishna', 'Vijayashanti', 'Brahmanandam', 'Hema']	[]	['India']	[]	['Telugu']	['romance']	[]
Gangster Gangaraju	2022	Eeshaan Surya	Apart from wanting to win the girl he loves, Gangaraju, a good-for-nothing guy, becomes a Gangster to save his village.	['Laksh Chadalavada', 'Vedieka Dutt', 'Charandeep', 'Vennela Kishore', 'Satya Krishnan', 'Rajshri Nair', 'Srikanth Iyengar', 'Sammeta Gandhi', 'Goparaju Ramana']	['Sri Tirumala Tirupati Venkateshwara Films']	['India']	[]	['Telugu']	['romance', 'action']	[]
Budugu	2015	Manmohan	Vamsi Krishna suffers from ADHD and therefore suffers miserably at school life. Due to his lack of performance in class and deviltry issues, he is constantly nagged by his parents. His studding mother Pooja spends time over his betterment but couldn’t comply with the difficulties of coping with a ADHD child since she has no clue what Bunny aka. Vamsi was going through. One fine day, parents decide to send him to boarding, thinking this to be the only viable option available for his improvement. And that’s where Bunny starts getting abnormal and starts getting connected to Diya. Who is Diya? Why did Parents consult a Psychiatrist Geetha? What happens next forms the rest of the story line.	['Indu Anand', 'Lakshmi Manchu', 'Indraja', 'Sana']	[]	['India']	[]	['Telugu']	['mystery', 'thriller']	[]
Palnati Yudham	1966	Ramineedu Gutha	When the minister of Palnadu opens the temple doors for all the castes in the kingdom, disputes arises in the kingdom leading to war.	['N.T. Rama Rao', 'Bhanumathi', 'Mikkilineni', 'Rajanala Kaleswara Rao', 'Ramineedu Gutha', 'Kanta Rao', 'Jamuna', 'Prabhakar Reddy', 'Vasanthi', 'Anjali Devi', 'Gummadi']	['Annapoorna Pictures']	['India']	[]	['Telugu']	['drama', 'music', 'history', 'war', 'romance']	[]
Gandharwa	2022	Apsar Hussain	Captain Avinash married Amulya in 1971 and was immediately called to duty by the Army headquarters. Unfortunately Avinash disappeared in a deep valley while chasing the enemy. Somehow he wakes up in 2021 but his attire and age remains as he was in 1971.	['Sandeep Madhav', 'Gayathri Suresh', 'Sai Akshitha', 'Sai Kumar', 'Posani Krishna Murali', 'Babu Mohan', 'Suresh', 'Sammeta Gandhi', 'Sheethal Bhat', 'Rohini', 'Jabardasth Ramprasad', 'V. S. Roopa Lakshmi', 'Temper Vamsi']	['Funny Fox Entertainment']	['India']	[]	['Telugu']	['thriller', 'mystery']	[]
Neeku Naaku Dash Dash	2012	Teja	Siva who studies in a village stands as a surity for his friend's loan. While the lender comes and asks for money,his friends refuses to return.So Siva had to drop his college and for returning the loan the lender takes him to the nearby town where he had to work under liquor mafia.There he meets Gayatri and some silly stuff goes on between them which turns into love and Gayatri comes to know that she is pregnant. Meanwhile Siva tries to get his mistake (getting Nagaraj killed because of him and his friend Toofan) set right by stealing the money from his owner and at the same time there would be chaos in the building they work. So finally they escape from them and then the plot goes on with their chase by the Chitti Thalli , Bapineedu and the police.	['Prince Cecil', 'Nandita Raj', 'Suman Shetty', 'Dharmavarupu Subramanyam', 'Tanikella Bharani', 'Venkateswara Rao Paruchuri']	['Bhavya Creations']	['India']	[]	['Telugu']	[]	[]
Goppinti Alludu	2000	E.V.V. Satyanarayana	Goppinti Alludu is a family based movie in which, Murali Manohar(Balakrishna) is son of the industrialist SVR(SPB). He arrives India from Switzerland after finishing his graduation. SVR fixes a girl for him and asks him to marry her. To get rid of unwanted marriage, Maohar escapes back to Switzerland. Sowmya(Simran) is the grand daughter of Achyuta Ramayya(Satyanarayana). Achyuta Ramayya	['Nandamuri Balakrishna', 'Simran', 'Sanghavi', 'S. P. Balasubramaniam', 'Kota Srinivasa Rao', 'Kaikala Satyanarayana', 'Chalapathi Rao', 'Prudhviraj', 'Saadhika Randhawa', 'Tanikella Bharani', 'Jayaprakash Reddy', 'Babloo Prithiveeraj', 'Ahuti Prasad', 'Mallikarjuna Rao', 'L. B. Sriram', 'Gundu Hanumantha Rao', 'Sudha', 'Sana', 'Hema', 'Madhumani', 'Kalpana Rai']	[]	['India']	[]	['Telugu']	['comedy', 'family']	[]
Shanti Kranti	1991	V. Ravichandran	An honest police officer investigates an organ trafficking racket. He soon discovers that it is operated by Daddy, a criminal, under the guise of an orphanage.	['Nagarjuna Akkineni', 'Juhi Chawla', 'Khushboo', 'Anant Nag', 'Annapoorna', 'Babu Antony', 'Kaikala Satyanarayana', 'Rohini']	['Sri Eswari Productions']	['India']	[]	['Telugu']	['music']	[]
Andaru Bagundali Andulo Nenundali	2022	Kiran Sripuram	Srinivas Rao, a hearing and speech-impaired man travels back home on a Hyderabad Metro Train but falls asleep. Another passenger. Sameer, finds this amusing and decides to post a picture of Srinivas Rao Online, labeling him a drunkard.	['Ali Basha', 'Naresh', 'Pavitra Lokesh', 'Mouryani', 'Pranavi Manukonda', 'Sana', 'Manju Bhargavi', 'Tanikella Bharani', 'S.V. Krishna Reddy', 'K. Atchi Reddy', 'Siva Reddy', 'Saptagiri', 'Madhusudhan Rao', 'Bhadram', 'Chammak Chandra', 'L. B. Sriram', 'Mano', 'Mukhtar Khan', 'Sai Kumar Pampana', 'Ananth Babu', 'Gautam Raju', 'Lasya Manjunath', 'Geetha Singh', 'Tanvi Raju']	['Aliwood Entertainment']	['India']	[]	['Telugu']	['drama', 'comedy', 'family']	[]
True	2021		The mysterious circumstances around the death of Vignesh's father leads him down a path filled with unexpected twists and turns. Nothing is as it seems, but will the truth finally set him free?	['Mandala Syam', 'Harish Vinay', 'Lavanya', 'Madhusudhan Rao']	[]	['India']	[]	['Telugu']	['thriller']	[]
Dhrushti	2019	Ram Abbaraju	A photographer's life, who is  temporarily wheelchair driven, goes into deep trouble, once he  witnesses a murder through his camera.	['Rahul Ravindran', 'Pavani Gangireddy', 'Vennela Kishore', 'Satya Prakash', 'Pramodini Pammi', 'Ravi Varma']	['M Square']	['India']	[]	['Telugu']	['crime', 'romance', 'thriller']	[]
Surya IPS	1991	A. Kodandarami Reddy		['Venkatesh', 'Vijayashanti', 'Charan Raj', 'R. Sarathkumar', 'Kaikala Satyanarayana', 'Tarun', 'Nutan Prasad', 'Kota Srinivasa Rao', 'Charu Haasan', 'Rallapalli Narasimha']	[]	['Maheswari Parameswari Films']	[]	['Telugu']	['action', 'drama']	[]
Badi Panthulu	1972	P. Chandrasekhara Reddy	Raghava Rao (N. T. Rama Rao) is a teacher in a government primary school. His wife is Janaki (Anjali Devi). Papa Rao (Nagabhushanam) is the school proprietor. The teacher lives with the commitment to basic values of life. He has two sons Satyam (Rama Krishna) and Venu (Krishnam Raju) and a daughter (T. Padmini). The school children built a house for their teacher with love and affection. After retirement, Raghava Rao has no choice but to live with his children.His ungrateful children sell the house of Raghava Rao and Janaki against their wishes. They separate their father and mother and take care of them by rotation even though the old couple wants to live together. Ramu (Jaggayya) is an old student of Raghava Rao who becomes a police officer. He purchases Raghava Rao's house in the auction and gifts it to his beloved teacher.	['N.T. Rama Rao', 'Anjali Devi', 'Krishnam Raju', 'Sridevi']	['Triveni Productions']	['India']	[]	['Telugu']	['drama', 'family']	[]
Kavisamrat	2022	Savithcchandra	Biography of Viswandha Satyanarayna. A Telugu Poet who ruled telugu literary world for five decades from 1920 to 1970	['L. B. Sriram', 'Ananth Babu', 'Thummala Narasimha Reddy', 'Ramajogayya Sastry']	[]	['Life is Beautiful Creations']	[]	['Telugu']	['history', 'drama']	[]
Asalu Em Jarigindhante	2020	Srinivas Bandari		['Mahendran', 'Sri Pallavi']	['ABR Productions', 'GSFilms']	['Telugu']	[]	['Telugu', 'English']	['comedy', 'romance']	[]
Nenu Student Sir!	2023	Rakhi Uppalapati		['Bellamkonda Ganesh', 'Avantika Dassani', 'Samuthirakani', 'Sunil Varma', 'Srikanth Iyengar', 'Jabardasth Ramprasad', 'Charandeep', 'Pramodini Pammi', 'Ravi Shiva Teja']	['SV2 Entertainment']	['India']	[]	['Telugu']	['thriller', 'romance', 'comedy']	[]
English Pellam East Godavari Mogudu	1999	Rudraraju Suresh Varma	The movie is about a lady Sireesha (played by Ramya Krishna) who wants to experiment the concept of dating in a culture conscious country like India.	['Srikanth Meka', 'Ramya Krishnan', 'Murali Mohan', 'Jayasudha', 'Brahmaji']	['VMC Productions']	['India']	[]	['Telugu']	[]	[]
Thanu Nenu	2015	P.Rammohan	Kiran(Santosh Shobhan) is a call center employee who hates America and NRI culture. One fine day, he comes across Keerthi(Avika Gor) and falls in love with her. As time passes by, even Keerthi approves his love and the couple spend some happy times together.  On the other hand, Keerthi’s father(Ravi Babu) is a shrewd man who only dreams of sending his daughter to the US for big bucks. Twist in the tale arises when he decides to get his daughter married to an NRI.  What will Kiran do now ? How will he stop Keerthi from leaving to the US ? Why does Kiran hate America ?	['Santosh Shoban', 'Avika Gor', 'Ravi Babu']	[]	['India']	[]	['Telugu']	['drama', 'romance']	[]
Alladin and the Wonderful Lamp	1957	T. R. Raghunath	Alladin throws away a magic lamp after an evil magician fools him into finding it. Years later, when Alladin learns the full extent of its powers, he decides to find and use it.	['Nageshwara Rao Akkineni', 'Anjali Devi', 'S. V. Ranga Rao', 'T. S. Balaiah', 'Relangi Venkata Ramaiah', 'Raja Sulokshana', 'K. Malathi']	['India']	['Telugu']	[]	['Telugu', 'Hindi', 'Tamil']	['fantasy', 'adventure', 'drama']	[]
Meka Suri	2020	Trinadh Velisila	Meka Suri is a 2020 ZEE5 Original Telugu crime thriller movie, starring Abhinay and Sumaya in the lead. The story revolves around Meka Suri, a butcher, who gets married to his love, Rani. However, when Rani gets brutally murdered by a group of people, Meka Suri decides to avenge her death with the help of Naxalites.	['Abhinay', 'Sumaya Syed', 'Naresh Byreddy', 'Sharat Kumar']	[]	['India']	[]	['Telugu']	['thriller', 'crime']	['Thrillers and murder mysteries', 'Crime, drugs and gangsters', 'High speed and special ops', 'bollywood, songs, climax, emotion or goosebumps', 'cops, murder, thriller, detective or crime', 'terrorism, thriller, gripping, intense or political', 'robbery, criminal, crime, heist or cops', 'violence, action, guns, cops or killing']
Bhale Manchi Chowka Beram	2018	Murali Krishna Mudidani	Courier boy Saleem and cab driver Parthu are roommates who lie to their parents about being in Dubai and live in Hyderabad instead. When they come in possession of Desa Rahasyalu, written by an ex-Army major Yakub Khan, they perceive it to be something more than what it is and try to sell it to Pakistan.	['Kerintha Nookaraju', 'Yamini Bhaskar', 'Mujtaba Ali Khan', 'Raja Ravindra', 'Parvateesam']	[]	['India']	[]	['Telugu']	['drama', 'comedy']	[]
Aaradhana	1976	B. V. Prasad	In a village which is located in a beautiful hilly area full of greenery and water bodies, there lives a villager called Gopi (N. T. Rama Rao) along with his sister Janaki (Vijaya Lalitha) by rearing goats. He leads a happy life by singing and playing the flute. Once Radha (Vanisri) a famous stage artist & singer comes to his village on break. There, she becomes interested towards Gopi by listening to his flute & music. They spend time together and Radha gradually becomes fascinated by him. Before she starts back, Gopi finally proposes to her and she gladly accepts.	['N.T. Rama Rao', 'Vanisri', 'Kongara Jaggayya', 'Gummadi', 'Vijayalalitha']	['Sri Bhaskara Chitra']	['India']	[]	['Telugu']	['drama', 'family']	[]
Kokila	1990	Geetha Krishna	Siddhartha, a typical young man, falls in love with Kokila. She too eventually falls for him and both get married. At first they live happily, however later on Siddhartha loses his eyes in an accident, which is when trouble starts for them.	['Shobana', 'Naresh', 'Sarath Babu', 'Geetha', 'Nassar', 'Kota Srinivasa Rao', 'Brahmanandam', 'Ranganath', 'Jeeva', 'Mallikarjuna Rao']	[]	['India']	[]	['Telugu']	['action', 'drama', 'crime']	[]
Sardar Papa Rayudu	1980	Dasari Narayana Rao	Paparayudu gets jailed for a murder that he didn't commit. So he tries to prove his innocence and he gets rid of all his enemies too.	['N.T. Rama Rao', 'Sridevi', 'Sharada', 'Rao Gopal Rao', 'Kaikala Satyanarayana', 'Mohan Babu', 'Allu Ramalingaiah']	[]	['India']	[]	['Telugu']	['history', 'drama', 'action']	[]
Pelli Pandiri	1998	Kodi Ramakrishna	Govind (Jagapati Babu) and Prakash (Prithuvi Raj) became best friends since Prakash's father (Raghunath Reddy) killed Govind's mother in a car accident. Despite his father refusal, Prakash took Murthy into his house.  A few years later, when Prakash goes to America to study, Govind leaves the house after hearing Prakash's parents who decide to give off him. An old man accommodates Govind and the man begin to call him by that name. Govind falls in love with Kasturi (Raasi) a blind flower seller. Kasturi's father (Costume Krishna) renounced to drink alcohol and he decided to go to work after Govind's preach, but he died the next day in a car accident. Being Kasturi's last relation, he admitted her into a hospital for an eye operation. In order to pay it, he takes come money from a drunk man's house. In a misunderstanding, he was arrested by the police and he was sent to jail.	['Jagapati Babu', 'Raasi', 'Prudhviraj', 'Sarath Babu', 'Suhasini Maniratnam']	['SRS Art Movies']	['India']	[]	['Telugu']	['family', 'drama']	[]
Ramu	1968	A. C. Tirulokchandar	A man faces many trials and tribulations while taking care of his son who has a hearing impairment. He goes through many hardships to emerge victorious for his son.	['N.T. Rama Rao', 'Jamuna', 'S. V. Ranga Rao', 'Chittor V. Nagaiah', 'Relangi Venkata Ramaiah', 'Ramana Reddy', 'Rajanala Kaleswara Rao', 'Kaikala Satyanarayana', 'Padmanabham', 'Allu Ramalingaiah', 'Suryakantham', 'Pushpalatha']	['AVM Productions']	['India']	[]	['Telugu']	['drama']	[]
Mr. King	2023	Sashidhar Chavali	Shiva is an RJ who is doing his thesis on airplane mechanism while Seetharama is cunning and complex. Umadevi and Vennela both fell in love with Shiva. How will Shiva untangle the love triangle and manage Seetharama Raju's twisted game?	['Tanikella Bharani', 'S.S. Kanchi', 'Mirchi Kiran', 'Vennela Kishore', 'Sharran Kumar', 'Murali Sharma']	['Hanvika Creations']	['India']	[]	['Telugu']	['romance', 'thriller', 'drama']	[]
Vinara Sodara Veera Kumara	2019	Sateesh Chandra Nadella	Ramana falls in love with Sulochana but their relationship fails to materialize due to which he decides to end his life. He then meets a soul that communicates with him to make him realize the importance of life over love.	['Priyanka Jain', 'Jhansi', 'Srinivasa Sayee']	['Laxman Cine Visions']	['India']	[]	['Telugu']	['romance']	[]
Boochamma Boochodu	2014		Boochamma Boochodu is a 2014 Sleeper Hit Telugu Horror-Comedy film directed by Rewan Yadu. The film features a honeymooning couple, Karthik (Shivaji) and Sravani (Kainaaz Motiwala),in their new farm house are punctuated by an aberration - ominous signs of the palatial house. The mysterious of the terrorizing spirits form the storyline. Supporting cast include comedians Brahmanandam, Vennela Kishore, Posani Krishna Murali, Venu, Tagubothu Ramesh, Dhanraj and Chammak Chandra.	['Brahmanandam', 'Sivaji Sontineni', 'Vennela Kishore', 'Posani Krishna Murali', 'Thagubothu Ramesh']	['Hezen Entertainments, Sneha Cinema']	['India']	[]	['Telugu']	[]	[]
Andagadu	2005	Pendyala Venkata Rama Rao	Though he's successful in his career composing commercial jingles, homely Sundaram (Rajendra Prasad) can't get a date. His solution? Learn black magic to attract mohini pisachi (sexually voracious female ghosts) that wander at night in search of available men. But when he meets Ramya (Damini), everything changes. Directed by Pendyala Venkata Rama Rao, this Indian comedy co-stars Bhavana, Harika, Sudha and Chandra Mohan.	['Rajendra Prasad', 'Damini', 'Chandramohan']	['Sri Nilaya Pictures']	['India']	[]	['Telugu']	['comedy']	[]
WET	2022	Y. Nithin	Water flows out of a person, mysteriously.	['Sri Harsha']	[]	['NO NARRATIVE FILMS']	[]	['Telugu']	['horror']	[]
L7	2016	Mukund Pandey	A man must go to great lengths to save his wife.	['Ajay', 'Thrigun', 'Pooja Jhaveri', 'Jagadish Talasila']	[]	['India']	[]	['Telugu']	['thriller']	[]
Romeo	2014	Gopi Ganesh	In Rome, a young man starts following an expat Indian girl around. It turns out he's harboring a dark secret, and insists that the girl accompany him back to India.	['Sairam Shankar', 'Adonika', 'Subbaraju', 'Pragathi Mahavadi', 'Ravi Teja']	[]	['Maharshi Cinema']	[]	['Telugu']	['drama']	[]
Game	2006	G. Ram Prasad	Vijay, a spoilt man, has to reach the court to attend an inheritance case. However, his short-tempered taxi driver hinders his plans and creates chaos.	['Mohan Babu', 'Vishnu Manchu', 'Shobana', 'Parvati Melton', 'Sunil Varma', 'Giri Babu', 'Shriya Saran', 'Brahmanandam', 'Posani Krishna Murali', 'Raghu Babu', 'Satyam Rajesh', 'Subbaraju', 'Ravi Prakash', 'Tanikella Bharani', 'Harshavardhan', 'Sumalatha']	[]	['India']	[]	['Telugu']	['thriller']	[]
Jagadeka Veeruni Katha	1961	Kadri Venkata Reddy	Once upon a time, there was a kingdom Udayagiri, its king (Mukkamala) has two sons Pratap (N. T. Rama Rao) a valiant man and Jagajithu (Lanka Satyam), a poltroon man that envies his brother. Pratap's life ambition is to couple up with Devakanyas the angels Jayanthi/Indrakumari (B. Saroja Devi), Nagini/Nagakumari (L. Vijayalakshmi), Varuni/Varunakumari (Jayanthi), and Marichi/Agnikumari (Bala). Upon knowing this, the angered king ostracizes him from the country.	['N.T. Rama Rao', 'B. Saroja Devi', 'Rajanala Kaleswara Rao', 'Relangi Venkata Ramaiah', 'C S R Anjaneyulu', 'Mikkilineni', 'Mukkamala', 'Vangara Venkata Subbaiah', 'Lanka Satyam', 'P. Kannamba', 'Rushyendramani', 'L. Vijayalakshmi', 'Girija', 'Kumari Kamala']	['Vijaya Productions']	['India']	[]	['Telugu']	['fantasy']	[]
