RRR	2022	S. S. Rajamouli	A fictional history of two legendary revolutionaries' journey away from home before they began fighting for their country in the 1920s.	"['N. T. Rama Rao Jr.', 'Ram Charan', 'Ajay Devgn', 'Alia Bhatt', 'Shriya Saran', 'Samuthirakani', 'Ray Stevenson', 'Alison Doody', 'Olivia Morris', 'Edward Sonnenblick', 'Makrand Deshpande', 'Chatrapathi Sekhar', 'Rajiv Kanakala', 'Rahul Ramakrishna', 'Ahmareen Anjum', 'Twinkle Sharma', 'Varun Buddhadev', 'Spandan Chaturvedi', 'R. Bhakti Klein', 'Mark Bennington', 'Gaurav Pareek', ""Alexx O'Nell"", 'S. S. Rajamouli', 'Kirron Arya', 'Akash Boro', 'Eduard Buhac', 'Narendra Singh Dhami', 'Oleh Karpenko', 'Ivan Kostadinov', 'Jason Yeboa', 'Andrew Lyon']"	['DVV Entertainment', 'Pen Studios', 'Lyca Productions']	['India']	['Telugu']	['Telugu', 'English']	['action', 'drama']	['Epic heroes', 'Epic history and literature', 'Song and dance', 'bollywood, songs, climax, emotion or goosebumps', 'martial arts, kung fu, choreography, cool or action-packed', 'historical, epic, battle, historic or fought', 'swords, adventure, fantasy, battle or epic', 'action, explosives, exciting, action-packed or villain']
Bāhubali: The Beginning	2015	S. S. Rajamouli	The young Shivudu is left as a foundling in a small village by his mother. By the time he’s grown up, it has become apparent that he possesses exceptional gifts. He meets the beautiful warrior princess Avanthika and learns that her queen has been held captive for the last 25 years. Shividu sets off to rescue her, discovering his own origins in the process.	['Prabhas', 'Rana Daggubati', 'Tamannaah Bhatia', 'Anushka Shetty', 'Ramya Krishnan', 'Nassar', 'Sathyaraj', 'Sudeep', 'Adivi Sesh', 'Tanikella Bharani', 'Prabhakar', 'Rohini', 'Rakesh Varre', 'Ramakrishna Meka', 'S. S. Rajamouli', 'Charandeep', 'Scarlett Mellish Wilson', 'Nora Fatehi', 'Gabriela Bertante', 'Bharani Shankar', 'Kalpalatha', 'John Kokken']	['Arka Media Works']	['India']	['Telugu']	['Telugu', 'Sanskrit (Saṁskṛta)']	['action', 'adventure', 'fantasy', 'drama']	['Epic history and literature', 'Epic heroes', 'historical, epic, battle, historic or fought', 'swords, adventure, fantasy, battle or epic', 'martial arts, kung fu, choreography, cool or action-packed', 'bollywood, songs, climax, emotion or goosebumps', 'shakespearean, kings, battle, breathtaking or epic']
Bāhubali 2: The Conclusion	2017	S. S. Rajamouli	When Mahendra, the son of Bāhubali, learns about his heritage, he begins to look for answers. His story is juxtaposed with past events that unfolded in the Mahishmati Kingdom.	['Prabhas', 'Rana Daggubati', 'Sathyaraj', 'Anushka Shetty', 'Nassar', 'Ramya Krishnan', 'Subbaraju', 'Tamannaah Bhatia', 'Prudhviraj', 'Rohini', 'Ashrita Vemuganti', 'Tanikella Bharani', 'Bharani Shankar', 'Kalpalatha']	['Arka Media Works']	['India']	[]	['Telugu']	['adventure', 'action', 'fantasy']	['Epic history and literature', 'Epic heroes', 'historical, epic, battle, historic or fought', 'bollywood, songs, climax, emotion or goosebumps', 'martial arts, kung fu, choreography, cool or action-packed', 'swords, adventure, fantasy, battle or epic', 'shakespearean, kings, battle, breathtaking or epic']
Eega	2012	S. S. Rajamouli	Nani is a flower decorator, madly in love with his neighbor Bindhu. He gets killed by the baddie, Sudeep, a powerful businessman. Nani comes back as a housefly to get his revenge.	['Sudeep', 'Samantha Ruth Prabhu', 'Nani', 'Adithya Menon', 'Thagubothu Ramesh', 'Santhanam', 'Devadarshini', 'Chatrapathi Sekhar', 'Srinivasa Reddy', 'Noel Sean', 'Sivannarayana Naripeddi', 'Rajiv Kanakala', 'Dhanraj Sukhram', 'Hamsa Nandini', 'S. S. Rajamouli', 'Crazy Mohan']	['Vaaraahi Chalana Chitram']	['India']	[]	['Telugu']	['fantasy', 'action', 'comedy']	['Song and dance', 'Epic heroes', 'Westerns', 'bollywood, songs, climax, emotion or goosebumps', 'action, villain, humor, funny or silly', 'swords, adventure, fantasy, battle or epic', 'western, cowboy, outlaw, wild or frontier', 'martial arts, kung fu, choreography, cool or action-packed']
Sita Ramam	2022	Hanu Raghavapudi	Afreen, a rebellious Pakistani student sets ablaze the car of an Indian in London. Angered Afreen returns to Pakistan to ask for money from her grandfather that she has to pay in a month's time as damages. However, she gets to know that he is no more and the only thing he has left for her is a letter-delivering task, written by Ram to Sita. As Afreen sets out to find Ram, there begins her journey of discovering the secret behind the 20-year-old letter.	['Dulquer Salmaan', 'Mrunal Thakur', 'Rashmika Mandanna', 'Sumanth', 'Gautham Vasudev Menon', 'Tharun Bhascker Dhaassyam', 'Vennela Kishore', 'Shatru', 'Sachin Khedekar', 'Prakash Raj', 'Ashwath Bhatt', 'Bhumika Chawla', 'Abhinaya', 'Jisshu Sengupta', 'Pawan Chopra', 'Rukmini Vijayakumar', 'Neeraj Kabi', 'Murali Sharma', 'Tinnu Anand', 'Nikhil Devadula', 'Mehroos Mir', 'Snigdha Bawa', 'Sunil Varma', 'Keshav Deepak', 'Rohini', 'Anish Kuruvilla', 'Rahul Ravindran']	['Vyjayanthi Movies', 'Swapna Cinema']	['India']	[]	['Telugu']	['drama', 'romance']	['Song and dance', 'Epic history and literature', 'bollywood, songs, climax, emotion or goosebumps', 'singing, musical, songs, tune or lyrics', 'historical, epic, battle, historic or fought', 'band, songs, concert, musician or lyrics', 'romance, emotion, relationships, feelings or captivating']
Pushpa: The Rise - Part 1	2021	Sukumar	Pushpa Raj is a coolie who rises in the world of red sandalwood smuggling. Along the way, he doesn’t shy from making an enemy or two.	['Allu Arjun', 'Fahadh Faasil', 'Rashmika Mandanna', 'Jagadeesh Prathap Bandari', 'Sunil Varma', 'Rao Ramesh', 'Dhananjay', 'Anasuya Bharadwaj', 'Ajay', 'Ajay Ghosh', 'Shri Tej', 'Shatru', 'Shanmukh', 'Pavari', 'Mime Gopi', 'Samantha Ruth Prabhu', 'Raj Tirandasu', 'Kalpalatha', 'Brahmaji', 'Malavika Wales', 'Rajsekhar Aningi', 'Dayanand Reddy', 'Meesam Suresh', 'Master Dhruvan']	['Mythri Movie Makers', 'Muttamsetty Media', 'Goldmines Telefilms']	['India']	[]	['Telugu']	['thriller', 'action', 'drama']	['Song and dance', 'Epic heroes', 'bollywood, songs, climax, emotion or goosebumps', 'martial arts, kung fu, choreography, cool or action-packed', 'action, explosives, exciting, action-packed or villain', 'violence, action, guns, cops or killing', 'western, cowboy, outlaw, wild or frontier']
Ante... Sundaraniki!	2022	Vivek Athreya	A man from a Brahmin family falls in love with a Christian girl. In order to convince their parents, they say contrasting lies which complicates the situation and leads to a comedy of errors.	['Nani', 'Nazriya Nazim Fahadh', 'Naresh', 'Rohini', 'N. Azhagamperumal', 'Nadhiya', 'Harshavardhan', 'Anupama Parameswaran', 'Aruna Bhikshu', 'Srikanth Iyengar', 'Venkatesh Maha', 'Tanvi Ram', 'Prudhviraj', 'Rahul Ramakrishna', 'Sai Ronak', 'Ali Basha', 'Pavitra Lokesh']	['Mythri Movie Makers']	['India']	[]	['Telugu']	['family', 'comedy', 'romance']	['Relationship comedy', 'Song and dance', 'chemistry, hilarious, romantic comedy, sweet or humorous', 'bollywood, songs, climax, emotion or goosebumps', 'musical, songs, singing, comedy or funny', 'romance, charming, comedy, witty or delightful', 'comedy, relationships, funny, quirky or humor']
Dasara	2023	Srikanth Odela	In 1990s, Set in small village Veerlapally, Dharani, Vennela, and Suri are childhood friends. Dharani loves Vennela, but she has Suri in her mind. Knowing Suri’s interest in Vennela, Dharani sacrifices his love and helps get them married. But Local politics between Rajanna, Shivanna and the latter's son Chinna Nambi threaten to disrupt their lives.	['Nani', 'Keerthy Suresh', 'Dheekshith Shetty', 'Sai Kumar', 'Shine Tom Chacko', 'Samuthirakani', 'Poorna', 'Rajsekhar Aningi', 'Jhansi']	['Sri Lakshmi Venkateswara Cinemas']	['India']	[]	['Telugu']	['thriller', 'action']	['Song and dance', 'Epic heroes', 'High speed and special ops', 'Westerns', 'bollywood, songs, climax, emotion or goosebumps', 'martial arts, kung fu, choreography, cool or action-packed', 'violence, action, guns, cops or killing', 'action, explosives, exciting, action-packed or villain', 'violence, shock, disturbing, brutal or graphic']
Jersey	2019	Gowtam Tinnanuri	After his career fails to take off, a gifted cricketer in his mid-thirties decides that he’s not ready to give up quite yet.	['Nani', 'Shraddha Srinath', 'Ronit Kamra', 'Harish Kalyan', 'Viswant Duddumpudi', 'Sathyaraj', 'Sanusha Santhosh', 'Sampath Raj', 'Shishir Sharma', 'Praveen', 'Jayaprakash', 'Rao Ramesh', 'Brahmaji', 'Bhupal Raju']	['Sithara Entertainments']	['India']	[]	['Telugu']	['drama']	['Song and dance', 'Underdogs and coming of age', 'Moving relationship stories', 'bollywood, songs, climax, emotion or goosebumps', 'sports, team, coach, athlete or football', 'family, emotional, emotion, touching or kids', 'boxing, fighting, champion, sports or fighter', 'touching, emotion, emotional, family or cry']
Ala Vaikunthapurramuloo	2020	Trivikram Srinivas	Fate plays a vital role in connecting the life of Bantu, a son who seeks validation from his cold-hearted father with the life of Raj, whose millionaire father wishes that he was more assertive.	['Allu Arjun', 'Pooja Hegde', 'Murali Sharma', 'Jayaram', 'Sushanth', 'Nivetha Pethuraj', 'Samuthirakani', 'Tabu', 'Navdeep', 'Sunil Varma', 'Rajendra Prasad', 'Rahul Ramakrishna', 'Brahmaji', 'Harshavardhan', 'Sachin Khedekar', 'Vennela Kishore', 'Brahmanandam', 'Ajay', 'Tanikella Bharani', 'Rohini', 'Govind Padmasoorya', 'Chammak Chandra', 'Vaishnavi Chaitanya', 'Tarzan', 'Pammi Sai', 'Ananth Babu', 'Kalyani Natarajan', 'Sirisha Sougandh', 'Hyper Adhi', 'Easwari Rao']	['Geetha Arts', 'Haarika & Hassine Creations', 'Goldmines Telefilms']	['India']	['Telugu']	['Telugu', 'Hindi']	['drama', 'action', 'comedy']	['Song and dance', 'bollywood, songs, climax, emotion or goosebumps', 'musical, songs, singing, comedy or funny', 'singing, musical, songs, tune or lyrics', 'dancing, choreography, songs, tune or musical', 'martial arts, kung fu, choreography, cool or action-packed']
Magadheera	2009	S. S. Rajamouli	When Harsha, a bike stunter from Vishakapatnam, accidentally meets Indu, he discovers his warrior life Kala Bhairava in his last birth. The remaining story explains how Indu and Kala Bhairava are connected.	['Ram Charan', 'Kajal Agarwal', 'Dev Gill', 'Srihari', 'Sunil Varma', 'Surya Bhagawan Das', 'Chatrapathi Sekhar', 'Sarath Babu', 'Saloni Aswani', 'Hema', 'Subbaraya Sharma', 'Brahmanandam', 'Rao Ramesh', 'Sameer Hasan', 'Chiranjeevi', 'Kim Sharma', 'Mumaith Khan']	['Geetha Arts']	['India']	['Telugu']	['Telugu', 'Sanskrit (Saṁskṛta)']	['action']	['Epic heroes', 'Epic history and literature', 'Song and dance', 'historical, epic, battle, historic or fought', 'bollywood, songs, climax, emotion or goosebumps', 'swords, adventure, fantasy, battle or epic', 'martial arts, kung fu, choreography, cool or action-packed', 'adventure, epic, exciting, action or tribe']
Shyam Singha Roy	2021	Rahul Sankrityan	A young filmmaker is in a soup right when he’s about to find his footing in the film industry. When he sets out to find an answer, turns out it’s in the past.	['Nani', 'Sai Pallavi', 'Krithi Shetty', 'Madonna Sebastian', 'Murali Sharma', 'Rahul Ravindran', 'Abhinav Gomatam', 'Ankith Koyya', 'Leela Samson', 'Jisshu Sengupta', 'Subhalekha Sudhakar', 'Anurag Kulkarni', 'Manish Wadhwa']	['Niharika Entertainment']	['India']	['Telugu']	['Telugu', 'Bengali, Bangla']	['romance', 'drama']	['Song and dance', 'Epic history and literature', 'bollywood, songs, climax, emotion or goosebumps', 'dancing, choreography, songs, tune or musical', 'singing, musical, songs, tune or lyrics', 'historical, epic, battle, historic or fought', 'band, songs, concert, musician or lyrics']
C/o Kancharapalem	2018	Venkatesh Maha	From a schoolboy’s crush to a middle-aged bachelor’s office romance, four love stories spanning age, religion and status unfold in a small Indian town.	['Mohan Bhagath', 'Praveena Paruchuri', 'Karthik Rathnam', 'Radha Bessy', 'Praneeta Patnaik', 'Nithya Sree', 'Kesava Karri', 'Kishore Kumar Polimera']	['Paruchuri Vijaya Praveena Arts']	['India']	[]	['Telugu']	['drama']	['Song and dance', 'Faith and religion', 'bollywood, songs, climax, emotion or goosebumps', 'religion, church, faith, beliefs or spiritual', 'singing, musical, songs, tune or lyrics', 'touching, emotion, emotional, family or cry', 'jesus, religion, faith, beliefs or holy']
Major	2022	Sashi Kiran Tikka	This biopic follows the life of Indian Army officer Major Sandeep Unnikrishnan, from his childhood to his heroic actions during the 2008 Mumbai attacks.	['Adivi Sesh', 'Sobhita Dhulipala', 'Saiee Manjrekar', 'Prakash Raj', 'Murali Sharma', 'Revathi', 'Vinay Nallakadi', 'Anish Kuruvilla', 'Sridevi', 'Pradeep Rudra']	['Sony Pictures Networks Productions', 'G. Mahesh Babu Entertainment Pvt. Ltd']	['India']	[]	['Telugu']	['drama', 'history', 'action']	['War and historical adventure', 'Epic history and literature', 'war, soldiers, combat, military or fought', 'historical, epic, battle, historic or fought', 'bollywood, songs, climax, emotion or goosebumps', 'war, wwii, combat, military or duty', 'political, democracy, documentary, president or propaganda']
Rangasthalam	2018	Sukumar	Chitti Babu begins to suspect his elder brother's life is in danger after they team up to lock horns with their village president and overthrow his unlawful 30 year old regime.	['Ram Charan', 'Samantha Ruth Prabhu', 'Aadhi Pinisetty', 'Jagapati Babu', 'Prakash Raj', 'Anasuya Bharadwaj', 'Pooja Hegde', 'Naresh', 'Rohini', 'Brahmaji', 'Pujita Ponnada', 'Baby Annie', 'Banerjee', 'Satya', 'Ajay Ghosh', 'Mahesh Achanta', 'Shatru', 'Amit Sharma', 'Chatrapathi Sekhar', 'Noel Sean', 'Rajiv Kanakala', 'Getup Srinu']	['Konidela Production Company', 'Mythri Movie Makers']	['India']	[]	['Telugu']	['action', 'drama']	['Song and dance', 'bollywood, songs, climax, emotion or goosebumps', 'singing, musical, songs, tune or lyrics', 'dancing, choreography, songs, tune or musical', 'terrorism, thriller, gripping, intense or political', 'boxing, fighting, champion, sports or fighter']
Saaho	2019	Sujeeth	"A battle for power ensues as warring gangters thrive to gain possession of a ""black box"" that can make them richer than they already are, and an undercover cop intervenes with the help of his sharp intellect and an instinct to kill."	['Prabhas', 'Shraddha Kapoor', 'Jackie Shroff', 'Neil Nitin Mukesh', 'Murali Sharma', 'Mandira Bedi', 'Arun Vijay', 'Vennela Kishore', 'Prakash Belawadi', 'Evelyn Sharma', 'Supreet', 'Chunky Pandey', 'Lal', 'Mahesh Manjrekar', 'Tinnu Anand', 'Aditya Srivastava', 'Jacqueline Fernandez', 'Girish Garladinne', 'Kumar Raja Venati', 'Naveen Varma Ganapathiraju', 'Sivakrishna', 'Sasha Chettri', 'Mukhtar Khan', 'Franaita Jijina']	['UV Creations']	['India']	[]	['Telugu']	['thriller', 'action']	['High speed and special ops', 'Epic heroes', 'Song and dance', 'bollywood, songs, climax, emotion or goosebumps', 'action, explosives, exciting, action-packed or villain', 'car, cars, action, adrenaline or racing', 'martial arts, kung fu, choreography, cool or action-packed', 'robbery, criminal, crime, heist or cops']
Virupaksha	2023	Karthik Varma Dandu	Set in a village named Rudravanam in 1990's, Surya along with his mother, visit there after a long time. Suddenly a series of mysterious deaths occur due to an unknown person's occult practice and whole village is scared. Will Surya find the person causing the deaths and save the village?	['Sai Dharam Tej', 'Samyuktha', 'Brahmaji', 'Sai Chand', 'Sunil Varma', 'Rajiv Kanakala', 'Abhinav Gomatam', 'Ajay', 'Shyamala', 'Kamal Kamaraju', 'Sai Kamakshi Bhaskarla', 'Chatrapathi Sekhar']	['Sukumar Writings', 'Sri Venkateswara Cine Chitra']	['India']	[]	['Telugu']	['fantasy', 'thriller', 'horror', 'mystery']	['Horror, the undead and monster classics', 'Thrillers and murder mysteries', 'Intense violence and sexual transgression', 'scary, horror, creepy, supernatural or frighten', 'horror, creepy, eerie, blood or gothic', 'horror, creepy, eerie, frighten or chilling', 'horror, gory, scary, killing or gruesome', 'horror, scientist, monster, doctor or experiment']
HIT: The 2nd Case	2022	Sailesh Kolanu	Krishna Dev aka KD, a laidback cop working in Andhra Pradesh State HIT, takes on a gruesome murder case. As KD unravels the layers of the crime, the stakes rise unbelievably high and the threat comes unusually close.	['Adivi Sesh', 'Meenakshi Chaudhary', 'Komalee Prasad', 'Maganti Srinath', 'Rao Ramesh', 'Suhas', 'Tanikella Bharani', 'Posani Krishna Murali', 'Harshavardhan', 'Srikanth Iyengar', 'Brahmaji', 'Bhanuchander', 'Nani', 'Vishwak Sen', 'Geeta Bhaskar', 'Kancharapalem Raju', 'Kedar Shankara', 'Pavani Karanam']	['Wall Poster Cinema']	['India']	[]	['Telugu']	['action', 'crime', 'thriller']	['Thrillers and murder mysteries', 'Crime, drugs and gangsters', 'cops, murder, thriller, detective or crime', 'mystery, murder, detective, murderer or clues', 'film noir, femme fatale, 1940s, thriller or intriguing', 'robbery, criminal, crime, heist or cops', 'bollywood, songs, climax, emotion or goosebumps']
Radhe Shyam	2022	Radha Krishna Kumar	Vikramaditya, a world-renowned palmist, believes love does not exist in his stars, until he meets Prerana. But when destiny tries to pull them apart, will love prevail?	['Prabhas', 'Pooja Hegde', 'Bhagyashree', 'Sathyaraj', 'Krishnam Raju', 'Jagapati Babu', 'Priyadarshi Pullikonda', 'Murali Sharma', 'Kunaal Roy Kapur', 'Sachin Khedekar', 'Riddhi Kumar', 'Sathyan Sivakumar', 'Jayaram', 'Thalaivasal Vijay', 'Sasha Chettri', 'Mahati Bikshu', 'Surya Bhagawan Das', 'Abhinay Raj Singh']	['UV Creations', 'T-Series', 'MSK Films']	['India']	[]	['Telugu']	['drama', 'romance']	['Song and dance', 'Epic heroes', 'Epic history and literature', 'bollywood, songs, climax, emotion or goosebumps', 'swords, adventure, fantasy, battle or epic', 'disaster, exciting, boats, voyage or adventure', 'historical, epic, battle, historic or fought', 'martial arts, kung fu, choreography, cool or action-packed']
Arjun Reddy	2017	Sandeep Reddy Vanga	When his girlfriend is forced to marry another man, a troubled young surgeon begins to self-destruct.	['Vijay Deverakonda', 'Shalini Pandey', 'Kamal Kamaraju', 'Kanchana', 'Rahul Ramakrishna', 'Sanjay Swaroop', 'Gopinath Bhat', 'Priyadarshi Pullikonda', 'Aditi Myakal', 'Anisha Alla', 'Sandhya Janak', 'Jia Sharma', 'Amit Sharma', 'Bhushan Kalyan', 'Sri Sudha Bhimireddy', 'Kalpalatha', 'Lahari Shari', 'Meesam Suresh']	['Bhadrakali Pictures']	['India']	[]	['Telugu']	['action', 'drama', 'romance']	['Underdogs and coming of age', 'Moving relationship stories', 'bollywood, songs, climax, emotion or goosebumps', 'surfing, teenager, friendship, adolescents or kids', 'emotional, emotion, sad, drama or illness', 'gambling, casino, unpredictable, drama or engaging', 'teenager, friendship, sad, adolescents or coming of age']
Agent Sai Srinivasa Athreya	2019	Swaroop RSJ	Agent Sai Srinivasa Athreya is a brilliant, underrated detective from Nellore who runs an agency called FBI which sees no business. He gets more than what he asked for when a case happens to fall right into his lap out of nowhere.	['Naveen Polishetty', 'Shruti Sharma', 'Suhas', 'Krishneswara Rao', 'Shredha Rajagopalan', 'Darbha Appaji Ambarisha', 'Ram Dutt', 'Divya Vineeth']	['Swadharm Entertainment']	['India']	[]	['Telugu']	['comedy', 'crime', 'mystery']	['Thrillers and murder mysteries', 'mystery, murder, detective, murderer or clues', 'bollywood, songs, climax, emotion or goosebumps', 'cops, murder, thriller, detective or crime', 'film noir, femme fatale, 1940s, thriller or intriguing', 'robbery, criminal, crime, heist or cops']
Waltair Veerayya	2023	Bobby Kolli	A notorious smuggler Waltair Veerayya is hired by a CI Seethapathi, reaches Malaysia with the ostensible mission of kidnapping a drug mafia leader named Solomon, who escaped India after wreaking havoc on the RAW agents and local policemen. Veerayya manages to pummel Solomon, who is fiercely protected by his ruthless gang-lord brother Kaala. Tables are turned, when Veerayya reveals that he shares a turbulent past with Kaala & an ACP Vikram Sagar who is hell-bent on ending his smuggling activities.	['Chiranjeevi', 'Shruti Haasan', 'Ravi Teja', 'Catherine Tresa', 'Bobby Simha', 'Prakash Raj', 'Rajendra Prasad', 'Vennela Kishore', 'Saptagiri', 'Pradeep Ram Singh Rawat', 'Srinivasa Reddy', 'Mukhtar Khan', 'Sathyaraj', 'Shakalaka Shankar', 'Urvashi Rautela', 'BVS Ravi', 'Kalpalatha', 'Mime Gopi', 'Nassar', 'Praveen', 'Vincent Asokan', 'Chammak Chandra', 'Rajendran', 'Manobala', 'Jhansi', 'Bharani Shankar', 'Subbaraju', 'Jayaprakash', 'Prabhas Sreenu', 'Raghu Babu', 'Kalyani Natarajan', 'B. S. Avinash', 'John Vijay', 'Anish Kuruvilla', 'Vinay Varma', 'Inturi Vasu', 'Mathew Varghese']	['Mythri Movie Makers']	['India']	[]	['Telugu']	['action', 'drama']	[]
Mahanati	2018	Nag Ashwin	Mahanati depicts the life and career of one of Telugu cinema's greatest and most iconic starlets, the first Indian female super star, Savitri.	['Keerthy Suresh', 'Dulquer Salmaan', 'Samantha Ruth Prabhu', 'Vijay Deverakonda', 'Prakash Raj', 'Shalini Pandey', 'Mohan Babu', 'Radha Krishna Jagarlamudi', 'Mahesh Achanta', 'Tharun Bhascker Dhaassyam', 'Malavika Nair', 'Sai Madhav Burra', 'Sandeep Reddy Vanga', 'Srinivas Avasarala', 'Naga Chaitanya Akkineni', 'Tulasi', 'Bhanupriya', 'Naresh', 'Manobala', 'Bindu Chandramouli', 'Vamsee Chaganti']	['Swapna Cinema', 'Vyjayanthi Movies']	['India']	[]	['Telugu']	['drama']	['Song and dance', 'Moving relationship stories', 'artists, biography, musician, songs or emotional', 'singing, musical, songs, tune or lyrics', 'bollywood, songs, climax, emotion or goosebumps', 'band, songs, concert, musician or lyrics', 'surfing, teenager, friendship, adolescents or kids']
Jathi Ratnalu	2021	Anudeep	Srikanth and his friends Sekhar and Ravi head to the city in pursuit of some izzat. Once there, they realise that maybe they were better off back home in Jogipet.	['Naveen Polishetty', 'Priyadarshi Pullikonda', 'Rahul Ramakrishna', 'Faria Abdullah', 'Brahmanandam', 'Murali Sharma', 'Brahmaji', 'Tanikella Bharani', 'Vennela Kishore', 'Keerthy Suresh', 'Vijay Deverakonda', 'Giri Babu', 'Mahesh Achanta', 'Naresh', 'Subhalekha Sudhakar', 'Divya Sripada', 'Anudeep']	['Swapna Cinema']	['India']	[]	['Telugu']	['drama', 'comedy']	['Crude humor and satire', 'Relationship comedy', 'Song and dance', 'funny, comedy, humor, jokes or hilarious', 'comedy, funny, hilarious, humor or jokes', 'musical, songs, singing, comedy or funny', 'comedy, funny, humor, hilarious or jokes', 'comedy, horror, funny, humor or spooky']
HIT: The First Case	2020	Sailesh Kolanu	Vikram Rudraraju is a 30-year-old cop working for the Telangana State Police. While Vikram is battling with his own traumatic past, the stakes get high when a girl called Preethi mysteriously disappears in Hyderabad and Vikram has to solve the case at any cost.	['Vishwak Sen', 'Ruhani Sharma', 'Brahmaji', 'Murali Sharma', 'Bhanuchander', 'Hari Teja', 'Ravi Varma', 'Kalpalatha', 'Mrudhula Basker', 'Chaitanya Sagiraju', 'Maganti Srinath']	['Wall Poster Cinema']	['India']	[]	['Telugu']	['thriller', 'action', 'drama']	['Thrillers and murder mysteries', 'High speed and special ops', 'cops, murder, thriller, detective or crime', 'mystery, murder, detective, murderer or clues', 'film noir, femme fatale, 1940s, thriller or intriguing', 'robbery, criminal, crime, heist or cops', 'terrorism, thriller, gripping, intense or political']
Mayabazar	1957	Kadri Venkata Reddy	Balarama promises Subhadra to get his daughter married to her son. However, when he loses his kingdom to the Kauravas, Balarama has no choice but to break his promise.	['N.T. Rama Rao', 'S. V. Ranga Rao', 'Savitri', 'Nageshwara Rao Akkineni', 'Gummadi', 'Mukkamala', 'C S R Anjaneyulu', 'Relangi Venkata Ramaiah', 'Rushyendramani', 'Nagabhushanam', 'Mikkilineni', 'Rajanala Nageswara Rao', 'Suryakantham', 'Ramana Reddy', 'Chadalavada', 'Allu Ramalingaiah', 'Vangara Venkata Subbaiah', 'Madhavapeddi Satyam', 'V Balakrishna', 'Sachu', 'Guru Gopinath', 'Mukku Raju', 'Chaya Devi']	['Vijaya Vahini Studios']	['India']	[]	['Telugu']	['drama', 'fantasy', 'comedy']	[]
Sarkaru Vaari Paata	2022	Parasuram Petla	Mahesh, a money lender, is swindled by a gambling addict called Kalaavathi in the US. While he comes to India to collect his debt, he decides to stay back and do his bit for the country's financial health.	['Mahesh Babu', 'Keerthy Suresh', 'Samuthirakani', 'Vennela Kishore', 'Subbaraju', 'Nadhiya', 'Posani Krishna Murali', 'Sowmya Menon', 'Tanikella Bharani', 'Ilez Badurgov', 'Brahmaji', 'Satyam Rajesh', 'Mahesh Manjrekar', 'Ajay', 'Ravi Prakash', 'Duy Beck', 'Nitika Rozenko', 'Nagendra Babu', 'Prabhas Sreenu', 'Sanjay Swaroop', 'Anish Kuruvilla', 'Bhupal Raju']	['Mythri Movie Makers', '14 Reels Plus', 'G. Mahesh Babu Entertainment Pvt. Ltd']	['India']	[]	['Telugu']	['drama', 'action']	['Song and dance', 'bollywood, songs, climax, emotion or goosebumps', 'western, cowboy, outlaw, wild or frontier', 'musical, songs, singing, comedy or funny', 'martial arts, kung fu, choreography, cool or action-packed', 'action, villain, humor, funny or silly']
Cinema Bandi	2021	Praveen Kandregula	A struggling rickshaw driver’s life takes a rollicking turn when he comes upon an expensive camera and decides to make a film with his fellow villagers.	['Sirivennela Yanamandhala', 'Sandeep Varanasi', 'Trishara', 'Sindhu Sreenivasa Murthy', 'Munivenkatapa', 'Uma Yg', 'Vikas Vasistha', 'Rag Mayur']	['D2R Films']	['India']	[]	['Telugu']	['comedy', 'drama']	[]
